iSession,iTrial,exclusion,superlative,universal_quantifier,exclusive_case,comparison,general_case,addition,all,un_pro,text
1,1,"[None, None, None, None]","[None, None, None, None]","[None, None, None, None]","[None, None, None, None]","[None, None, None, None]","[0.25, 0.75, 0.75, 0.25]","[None, None, None, None]","[0.25, 0.75, 0.75, 0.25]",[],头长，腿长，脖子、尾巴短。
1,2,"[None, None, None, None]","[None, None, None, None]","[None, None, None, None]","[None, None, None, None]","[None, None, None, None]","[0.25, 0.75, 0.75, 0.25]","[None, None, None, None]","[0.25, 0.75, 0.75, 0.25]",[],头长，腿长，脖子、尾巴较短。
1,3,"[None, None, None, None]","[None, None, None, None]","[None, None, None, None]","[None, None, None, None]","[None, None, None, None]","[0.75, 0.25, 0.25, 0.75]","[None, None, None, None]","[0.75, 0.25, 0.25, 0.75]",[],头、腿较短，脖子、尾巴较长。
1,4,"[None, None, None, None]","[None, None, None, None]","[None, None, None, None]","[None, None, None, None]","[None, None, None, None]","[0.75, 0.25, 0.25, 0.75]","[None, None, None, None]","[0.75, 0.25, 0.25, 0.75]",[],脖子、尾巴较长，头、腿略短。
1,5,"[None, None, None, None]","[None, None, None, None]","[None, None, None, None]","[None, None, None, None]","[None, None, None, None]","[0.25, 0.75, 0.75, 0.25]","[None, None, None, None]","[0.25, 0.75, 0.75, 0.25]",[],头、腿较长，脖子、尾巴较短。
1,6,"[None, None, None, None]","[None, None, None, None]","[None, None, None, None]","[None, None, None, None]","[None, None, None, None]","[0.75, 0.25, 0.25, 0.75]","[None, None, None, None]","[0.75, 0.25, 0.25, 0.75]",[],脖子较长，尾巴较长，头、腿略短。
1,7,"[None, None, None, None]","[None, None, None, None]","[None, None, None, None]","[None, None, None, None]","[None, None, None, None]","[0.75, 0.25, 0.75, 0.25]","[None, None, None, None]","[0.75, 0.25, 0.75, 0.25]",[],脖子、腿较长，头、尾巴较短。
1,8,"[None, None, None, None]","[None, None, None, None]","[None, None, None, None]","[None, None, None, None]","[None, None, None, None]","[0.5, 0.5, 0.25, 0.5]","[None, None, None, None]","[0.5, 0.5, 0.25, 0.5]",[],腿短，头、脖子、尾巴中等长度。
1,9,"[None, None, None, None]","[None, None, None, None]","[None, None, None, None]","[None, None, None, None]","[None, None, None, None]","[0.25, 0.25, 0.75, 0.5]","[None, None, None, None]","[0.25, 0.25, 0.75, 0.5]",[],腿长，头、脖子短，尾巴中等长度。
1,10,"[None, None, None, None]","[None, None, None, None]","[None, None, None, None]","[None, None, None, None]","[None, None, None, None]","[0.25, 0.75, 0.5, 0.5]","[None, None, None, None]","[0.25, 0.75, 0.5, 0.5]",[],头长，脖子较短，尾巴、腿中等长度。
1,11,"[None, None, None, None]","[None, None, None, None]","[None, None, None, None]","[None, None, None, None]","[None, None, None, None]","[0.25, 0.25, 0.75, 0.75]","[None, None, None, None]","[0.25, 0.25, 0.75, 0.75]",[],腿、尾巴长，头、脖子较短。
1,12,"[None, None, None, None]","[None, None, None, None]","[None, None, None, None]","[None, None, None, None]","[None, None, None, None]","[0.75, 0.75, 0.25, 0.25]","[None, None, None, None]","[0.75, 0.75, 0.25, 0.25]",[],腿、尾巴短，头、脖子较长。
1,13,"[None, None, None, None]","[None, None, None, None]","[None, None, None, None]","[None, None, None, None]","[None, None, None, None]","[0.75, 0.25, 0.25, 0.25]","[None, None, None, None]","[0.75, 0.25, 0.25, 0.25]",[],头、腿、尾巴短，脖子较长。
1,14,"[None, None, None, None]","[None, None, None, None]","[None, None, None, None]","[None, None, None, None]","[None, None, None, None]","[0.25, 0.75, 0.75, 0.25]","[None, None, None, None]","[0.25, 0.75, 0.75, 0.25]",[],腿、头长， 脖子、尾巴较短。
1,15,"[None, None, None, None]","[None, None, None, None]","[None, None, None, None]","[None, None, None, None]","[None, None, None, None]","[0.5, 0.5, 0.25, 0.5]","[None, None, None, None]","[0.5, 0.5, 0.25, 0.5]",[],腿短，头、脖子、尾巴中等长度。
1,16,"[None, None, None, None]","[None, None, None, None]","[None, None, None, None]","[None, None, None, None]","[None, None, None, None]","[0.25, 0.75, 0.25, 0.25]","[None, None, None, None]","[0.25, 0.75, 0.25, 0.25]",[],腿短，头较长，脖子、尾巴较短。
1,17,"[None, None, None, None]","[None, None, None, None]","[None, None, None, None]","[None, None, None, None]","[None, None, None, None]","[0.75, 0.5, 0.25, 0.5]","[None, None, None, None]","[0.75, 0.5, 0.25, 0.5]",[],腿短，脖子长，头、尾巴中等长度。
1,18,"[None, None, None, None]","[None, None, None, None]","[None, None, None, None]","[None, None, None, None]","[None, None, None, None]","[0.5, 0.25, 0.75, 0.5]","[None, None, None, None]","[0.5, 0.25, 0.75, 0.5]",[],腿长，头短，脖子、尾巴中等长度。
1,19,"[None, None, None, None]","[None, None, None, None]","[None, None, None, None]","[None, None, None, None]","[None, None, None, None]","[0.5, 0.5, 0.5, 0.5]","[None, None, None, None]","[0.5, 0.5, 0.5, 0.5]",[],头、脖子、腿、尾巴中等长度。
1,20,"[None, None, None, None]","[None, None, None, None]","[None, None, None, None]","[None, None, None, None]","[None, None, None, None]","[0.25, 0.75, 0.75, 0.75]","[None, None, None, None]","[0.25, 0.75, 0.75, 0.75]",[],头、尾巴、腿长，脖子较短。
1,21,"[None, None, None, None]","[None, None, None, None]","[None, None, None, None]","[None, None, None, None]","[None, None, None, None]","[0.5, 0.25, 0.5, 0.75]","[None, None, None, None]","[0.5, 0.25, 0.5, 0.75]",[],头短，尾巴长，脖子、腿中等长度。
1,22,"[None, None, None, None]","[None, None, None, None]","[None, None, None, None]","[None, None, None, None]","[None, None, None, None]","[0.25, 0.25, 0.25, 0.75]","[None, None, None, None]","[0.25, 0.25, 0.25, 0.75]",[],头、脖子、腿短，尾巴长。
1,23,"[None, None, None, None]","[None, None, None, None]","[None, None, None, None]","[None, None, None, None]","[None, None, None, None]","[0.75, 0.75, 0.5, 0.5]","[None, None, None, None]","[0.75, 0.75, 0.5, 0.5]",[],头、脖子长，腿、尾巴中等长度。
1,24,"[None, None, None, None]","[None, None, None, None]","[None, None, None, None]","[None, None, None, None]","[None, None, None, None]","[0.75, 0.25, 0.75, 0.25]","[None, None, None, None]","[0.75, 0.25, 0.75, 0.25]",[],脖子、腿长，头、尾巴较短。
1,25,"[None, None, None, None]","[None, None, None, None]","[None, None, None, None]","[None, None, None, None]","[None, None, None, None]","[0.25, 0.75, 0.75, 0.25]","[None, None, None, None]","[0.25, 0.75, 0.75, 0.25]",[],头、腿较长，脖子、尾巴较短。
1,26,"[None, None, None, None]","[None, None, None, None]","[None, None, None, None]","[None, None, None, None]","[None, None, None, None]","[0.25, 0.25, 0.75, 0.75]","[None, None, None, None]","[0.25, 0.25, 0.75, 0.75]",[],腿、尾巴较长，头、脖子较短。
1,27,"[None, None, None, None]","[None, None, None, None]","[None, None, None, None]","[None, None, None, None]","[None, None, None, None]","[0.75, 0.75, 0.25, 0.25]","[None, None, None, None]","[0.75, 0.75, 0.25, 0.25]",[],腿、尾巴短，头、脖子较长。
1,28,"[None, None, None, None]","[None, None, None, None]","[None, None, None, None]","[None, None, None, None]","[None, None, None, None]","[0.75, 0.75, 0.25, 0.25]","[None, None, None, None]","[0.75, 0.75, 0.25, 0.25]",[],腿、尾巴短，头、脖子较长。
1,29,"[None, None, None, None]","[None, None, None, None]","[None, None, None, None]","[None, None, None, None]","[None, None, None, None]","[0.25, 0.75, 0.75, 0.75]","[None, None, None, None]","[0.25, 0.75, 0.75, 0.75]",[],脖子短，头、腿、尾巴较长。
1,30,"[None, None, None, None]","[None, None, None, None]","[None, None, None, None]","[None, None, None, None]","[None, None, None, None]","[0.5, 0.5, 0.25, 0.5]","[None, None, None, None]","[0.5, 0.5, 0.25, 0.5]",[],腿短，头、脖子、尾巴中等长度。
1,31,"[None, None, None, None]","[None, None, None, None]","[None, None, None, None]","[None, None, None, None]","[None, None, None, None]","[0.5, 0.75, 0.25, 0.5]","[None, None, None, None]","[0.5, 0.75, 0.25, 0.5]",[],腿较短，头较长，脖子、尾巴中等长度。
1,32,"[None, None, None, None]","[None, None, None, None]","[None, None, None, None]","[None, None, None, None]","[None, None, None, None]","[0.75, 0.75, 0.5, 0.5]","[None, None, None, None]","[0.75, 0.75, 0.5, 0.5]",[],头、脖子长，腿、尾巴中等长度。
1,33,"[None, None, None, None]","[None, None, None, None]","[None, None, None, None]","[None, None, None, None]","[None, None, None, None]","[0.75, 0.75, 0.75, 0.25]","[None, None, None, None]","[0.75, 0.75, 0.75, 0.25]",[],尾巴短，头、脖子、腿长。
1,34,"[None, None, None, None]","[None, None, None, None]","[None, None, None, None]","[None, None, None, None]","[None, None, None, None]","[0.5, 0.5, 0.5, 0.5]","[None, None, None, None]","[0.5, 0.5, 0.5, 0.5]",[],头、脖子、腿、尾巴中等长度。
1,35,"[None, None, None, None]","[None, None, None, None]","[None, None, None, None]","[None, None, None, None]","[None, None, None, None]","[0.25, 0.5, 0.75, 0.75]","[None, None, None, None]","[0.25, 0.5, 0.75, 0.75]",[],脖子短，尾巴、腿长，头中等长度。
1,36,"[None, None, None, None]","[None, None, None, None]","[None, None, None, None]","[None, None, None, None]","[None, None, None, None]","[0.5, 0.5, 0.5, 0.5]","[None, None, None, None]","[0.5, 0.5, 0.5, 0.5]",[],头、脖子、腿、尾巴中等长度。
1,37,"[None, None, None, None]","[None, None, None, None]","[None, None, None, None]","[None, None, None, None]","[None, None, None, None]","[0.25, 0.75, 0.75, 0.75]","[None, None, None, None]","[0.25, 0.75, 0.75, 0.75]",[],脖子短，头、腿、尾巴长。
1,38,"[None, None, None, None]","[None, None, None, None]","[None, None, None, None]","[None, None, None, None]","[None, None, None, None]","[0.5, 0.5, 0.5, 0.5]","[None, None, None, None]","[0.5, 0.5, 0.5, 0.5]",[],头、脖子、腿、尾巴中等长度。
1,39,"[None, None, None, None]","[None, None, None, None]","[None, None, None, None]","[None, None, None, None]","[None, None, None, None]","[0.75, 0.75, 0.75, 0.25]","[None, None, None, None]","[0.75, 0.75, 0.75, 0.25]",[],头、脖子长，腿长，尾巴短。
1,40,"[None, None, None, None]","[None, None, None, None]","[None, None, None, None]","[None, None, None, None]","[None, None, None, None]","[0.75, 0.75, 0.75, 0.25]","[None, None, None, None]","[0.75, 0.75, 0.75, 0.25]",[],头、脖子长，腿长，尾巴短。
1,41,"[None, None, None, None]","[None, None, None, None]","[None, None, None, None]","[None, None, None, None]","[None, None, None, None]","[0.75, 0.75, 0.75, 0.25]","[None, None, None, None]","[0.75, 0.75, 0.75, 0.25]",[],头、脖子长，腿长，尾巴短。
1,42,"[None, None, None, None]","[None, None, None, None]","[None, None, None, None]","[None, None, None, None]","[None, None, None, None]","[0.5, 0.75, 0.75, 0.75]","[None, None, None, None]","[0.5, 0.75, 0.75, 0.75]",[],尾巴长，腿较长，头较长，脖子中等长度。
1,43,"[None, None, None, None]","[None, None, None, None]","[None, None, None, None]","[None, None, None, None]","[None, None, None, None]","[0.75, 0.25, 0.25, 0.75]","[None, None, None, None]","[0.75, 0.25, 0.25, 0.75]",[],头、腿短，脖子、尾巴较长。
1,44,"[None, None, None, None]","[None, None, None, None]","[None, None, None, None]","[None, None, None, None]","[None, None, None, None]","[0.75, 0.25, 0.5, 0.5]","[None, None, None, None]","[0.75, 0.25, 0.5, 0.5]",[],脖子长，头短，腿、尾巴中等长度。
1,45,"[None, None, None, None]","[None, None, None, None]","[None, None, None, None]","[None, None, None, None]","[None, None, None, None]","[0.75, 0.75, 0.25, 0.75]","[None, None, None, None]","[0.75, 0.75, 0.25, 0.75]",[],头、脖子、尾巴长，腿较短。
1,46,"[None, None, None, None]","[None, None, None, None]","[None, None, None, None]","[None, None, None, None]","[None, None, None, None]","[0.75, 0.75, 0.25, 0.75]","[None, None, None, None]","[0.75, 0.75, 0.25, 0.75]",[],头、脖子、尾巴长，腿较短。
1,47,"[None, None, None, None]","[None, None, None, None]","[None, None, None, None]","[None, None, None, None]","[None, None, None, None]","[0.75, 0.75, 0.25, 0.75]","[None, None, None, None]","[0.75, 0.75, 0.25, 0.75]",[],头、脖子、尾巴长，腿较短。
1,48,"[None, None, None, None]","[None, None, None, None]","[None, None, None, None]","[None, None, None, None]","[None, None, None, None]","[0.625, 0.5, 0.5, 0.625]","[None, None, None, None]","[0.625, 0.5, 0.5, 0.625]",[],头、脖子、尾巴、腿中等长度，尾巴、脖子略长。
1,49,"[None, None, None, None]","[None, None, None, None]","[None, None, None, None]","[None, None, None, None]","[None, None, None, None]","[0.25, 0.5, 0.5, 0.5]","[None, None, None, None]","[0.25, 0.5, 0.5, 0.5]",[],脖子短，头、腿、尾巴中等长度。
1,50,"[None, None, None, None]","[None, None, None, None]","[None, None, None, None]","[None, None, None, None]","[None, None, None, None]","[0.75, 0.5, 0.5, 0.75]","[None, None, None, None]","[0.75, 0.5, 0.5, 0.75]",[],脖子、尾巴长，头、腿中等长度。
1,51,"[None, None, None, None]","[None, None, None, None]","[None, None, None, None]","[None, None, None, None]","[None, None, None, None]","[0.75, 0.75, 0.5, 0.5]","[None, None, None, None]","[0.75, 0.75, 0.5, 0.5]",[],头、脖子长，腿、尾巴中等长度。
1,52,"[None, None, None, None]","[None, None, None, None]","[None, None, None, None]","[None, None, None, None]","[None, None, None, None]","[0.5, 0.5, 0.75, 0.25]","[None, None, None, None]","[0.5, 0.5, 0.75, 0.25]",[],尾巴短，腿长，头、脖子中等长度。
1,53,"[None, None, None, None]","[None, None, None, None]","[None, None, None, None]","[None, None, None, None]","[None, None, None, None]","[0.75, 0.25, 0.25, 0.25]","[None, None, None, None]","[0.75, 0.25, 0.25, 0.25]",[],脖子长，头、腿、尾巴较短。
1,54,"[None, None, None, None]","[None, None, None, None]","[None, None, None, None]","[None, None, None, None]","[None, None, None, None]","[0.25, 0.25, 0.25, 0.75]","[None, None, None, None]","[0.25, 0.25, 0.25, 0.75]",[],尾巴长，脖子、头、腿较短。
1,55,"[None, None, None, None]","[None, None, None, None]","[None, None, None, None]","[None, None, None, None]","[None, None, None, None]","[0.5, 0.25, 0.5, 0.75]","[None, None, None, None]","[0.5, 0.25, 0.5, 0.75]",[],尾巴长，头短，脖子、腿中等长度。
1,56,"[None, None, None, None]","[None, None, None, None]","[None, None, None, None]","[None, None, None, None]","[None, None, None, None]","[0.5, 0.25, 0.5, 0.75]","[None, None, None, None]","[0.5, 0.25, 0.5, 0.75]",[],头短，尾巴长，脖子、腿中等长度。
1,57,"[None, None, None, None]","[None, None, None, None]","[None, None, None, None]","[None, None, None, None]","[None, None, None, None]","[0.5, 0.5, 0.25, 0.5]","[None, None, None, None]","[0.5, 0.5, 0.25, 0.5]",[],腿短，头、脖子、尾巴中等长度。
1,58,"[None, None, None, None]","[None, None, None, None]","[None, None, None, None]","[None, None, None, None]","[None, None, None, None]","[0.5, 0.5, 0.5, 0.5]","[None, None, None, None]","[0.5, 0.5, 0.5, 0.5]",[],头、脖子、腿、尾巴中等长度。
1,59,"[None, None, None, None]","[None, None, None, None]","[None, None, None, None]","[None, None, None, None]","[None, None, None, None]","[0.5, 0.25, 0.75, 0.25]","[None, None, None, None]","[0.5, 0.25, 0.75, 0.25]",[],头、尾巴短，腿长，脖子中等长度。
1,60,"[None, None, None, None]","[None, None, None, None]","[None, None, None, None]","[None, None, None, None]","[None, None, None, None]","[0.5, 0.5, 0.5, 0.25]","[None, None, None, None]","[0.5, 0.5, 0.5, 0.25]",[],尾巴短，腿、脖子、头中等长度。
1,61,"[None, None, None, None]","[None, None, None, None]","[None, None, None, None]","[None, None, None, None]","[None, None, None, None]","[0.75, 0.25, 0.25, 0.75]","[None, None, None, None]","[0.75, 0.25, 0.25, 0.75]",[],尾巴、脖子长，头、腿短。
1,62,"[None, None, None, None]","[None, None, None, None]","[None, None, None, None]","[None, None, None, None]","[None, None, None, None]","[0.75, 0.25, 0.25, 0.75]","[None, None, None, None]","[0.75, 0.25, 0.25, 0.75]",[],尾巴、脖子长，头、腿短。
1,63,"[None, None, None, None]","[None, None, None, None]","[None, None, None, None]","[None, None, None, None]","[None, None, None, None]","[0.5, 0.5, 0.5, 0.5]","[None, None, None, None]","[0.5, 0.5, 0.5, 0.5]",[],尾巴、脖子、头、腿中等长度。
1,64,"[None, None, None, None]","[None, None, None, None]","[None, None, None, None]","[None, None, None, None]","[None, None, None, None]","[0.25, 0.5, 0.5, 0.5]","[None, None, None, None]","[0.25, 0.5, 0.5, 0.5]",[],脖子短，头、腿、尾巴中等长度。
1,65,"[None, None, None, None]","[None, None, None, None]","[None, None, None, None]","[None, None, None, None]","[None, None, None, None]","[0.5, 0.75, 0.5, 0.5]","[None, None, None, None]","[0.5, 0.75, 0.5, 0.5]",[],头长，脖子、尾巴、腿长中等长度。
1,66,"[None, None, None, None]","[None, None, None, None]","[None, None, None, None]","[None, None, None, None]","[None, None, None, None]","[0.5, 0.25, 0.5, 0.5]","[None, None, None, None]","[0.5, 0.25, 0.5, 0.5]",[],头短，脖子、尾巴、腿中等长度。
1,67,"[None, None, None, None]","[None, None, None, None]","[None, None, None, None]","[None, None, None, None]","[None, None, None, None]","[0.5, 0.5, 0.25, 0.5]","[None, None, None, None]","[0.5, 0.5, 0.25, 0.5]",[],腿短，头、脖子、尾巴中等长度。
1,68,"[None, None, None, None]","[None, None, None, None]","[None, None, None, None]","[None, None, None, None]","[None, None, None, None]","[0.25, 0.5, 0.5, 0.75]","[None, None, None, None]","[0.25, 0.5, 0.5, 0.75]",[],尾巴长，脖子短，头、腿中等长度。
1,69,"[None, None, None, None]","[None, None, None, None]","[None, None, None, None]","[None, None, None, None]","[None, None, None, None]","[0.25, 0.75, 0.75, 0.25]","[None, None, None, None]","[0.25, 0.75, 0.75, 0.25]",[],脖子、尾巴较短，头、腿较长。
1,70,"[None, None, None, None]","[None, None, None, None]","[None, None, None, None]","[None, None, None, None]","[None, None, None, None]","[0.75, 0.5, 0.5, 0.5]","[None, None, None, None]","[0.75, 0.5, 0.5, 0.5]",[],脖子长，头、尾巴、腿中等长度。
1,71,"[None, None, None, None]","[None, None, None, None]","[None, None, None, None]","[None, None, None, None]","[None, None, None, None]","[0.75, 0.75, 0.25, 0.5]","[None, None, None, None]","[0.75, 0.75, 0.25, 0.5]",[],头、脖子长，腿短，尾巴中等长度。
1,72,"[None, None, None, None]","[None, None, None, None]","[None, None, None, None]","[None, None, None, None]","[None, None, None, None]","[0.5, 0.5, 0.25, 0.75]","[None, None, None, None]","[0.5, 0.5, 0.25, 0.75]",[],尾巴长，腿短，头、脖子中等长度。
1,73,"[None, None, None, None]","[None, None, None, None]","[None, None, None, None]","[None, None, None, None]","[None, None, None, None]","[0.5, 0.5, 0.75, 0.5]","[None, None, None, None]","[0.5, 0.5, 0.75, 0.5]",[],腿长，头、脖子、尾巴中等长度。
1,74,"[None, None, None, None]","[None, None, None, None]","[None, None, None, None]","[None, None, None, None]","[None, None, None, None]","[0.5, 0.75, 0.25, 0.5]","[None, None, None, None]","[0.5, 0.75, 0.25, 0.5]",[],头长，腿短，脖子、尾巴中等长度。
1,75,"[None, None, None, None]","[None, None, None, None]","[None, None, None, None]","[None, None, None, None]","[None, None, None, None]","[0.25, 0.75, 0.75, 0.75]","[None, None, None, None]","[0.25, 0.75, 0.75, 0.75]",[],头、尾巴、腿长，脖子短。
1,76,"[None, None, None, None]","[None, None, None, None]","[None, None, None, None]","[None, None, None, None]","[None, None, None, None]","[0.5, 0.5, 0.5, 0.5]","[None, None, None, None]","[0.5, 0.5, 0.5, 0.5]",[],头、脖子、腿、尾巴中等长度。
1,77,"[None, None, None, None]","[None, None, None, None]","[None, None, None, None]","[None, None, None, None]","[None, None, None, None]","[0.5, 0.5, 0.75, 0.5]","[None, None, None, None]","[0.5, 0.5, 0.75, 0.5]",[],腿长，头、脖子、尾巴中等长度。
1,78,"[None, None, None, None]","[None, None, None, None]","[None, None, None, None]","[None, None, None, None]","[None, None, None, None]","[0.75, 0.5, 0.5, 0.5]","[None, None, None, None]","[0.75, 0.5, 0.5, 0.5]",[],脖子长，头、腿、尾巴中等长度。
1,79,"[None, None, None, None]","[None, None, None, None]","[None, None, None, None]","[None, None, None, None]","[None, None, None, None]","[0.25, 0.75, 0.25, 0.75]","[None, None, None, None]","[0.25, 0.75, 0.25, 0.75]",[],尾巴长，腿短，脖子较短，头较长。
1,80,"[None, None, None, None]","[None, None, None, None]","[None, None, None, None]","[None, None, None, None]","[None, None, None, None]","[0.5, 0.75, 0.25, 0.5]","[None, None, None, None]","[0.5, 0.75, 0.25, 0.5]",[],头长，腿短，脖子、尾巴中等长度。
1,81,"[None, None, None, None]","[None, None, None, None]","[None, None, None, None]","[None, None, None, None]","[None, None, None, None]","[0.75, 0.5, 0.75, 0.75]","[None, None, None, None]","[0.75, 0.5, 0.75, 0.75]",[],脖子、腿、尾巴长，头中等长度。
1,82,"[None, None, None, None]","[None, None, None, None]","[None, None, None, None]","[None, None, None, None]","[None, None, None, None]","[0.5, 0.75, 0.5, 0.5]","[None, None, None, None]","[0.5, 0.75, 0.5, 0.5]",[],头长，脖子、尾巴、腿中等长度。
1,83,"[None, None, None, None]","[None, None, None, None]","[None, None, None, None]","[None, None, None, None]","[None, None, None, None]","[0.5, 0.5, 0.5, 0.75]","[None, None, None, None]","[0.5, 0.5, 0.5, 0.75]",[],尾巴长，头、脖子、腿中等长度。
1,84,"[None, None, None, None]","[None, None, None, None]","[None, None, None, None]","[None, None, None, None]","[None, None, None, None]","[0.25, 0.75, 0.25, 0.75]","[None, None, None, None]","[0.25, 0.75, 0.25, 0.75]",[],脖子、腿较短，头、尾巴较长。
1,85,"[None, None, None, None]","[None, None, None, None]","[None, None, None, None]","[None, None, None, None]","[None, None, None, None]","[0.25, 0.75, 0.75, 0.75]","[None, None, None, None]","[0.25, 0.75, 0.75, 0.75]",[],腿、尾巴长，脖子短，头较长。
1,86,"[None, None, None, None]","[None, None, None, None]","[None, None, None, None]","[None, None, None, None]","[None, None, None, None]","[0.75, 0.5, 0.5, 0.75]","[None, None, None, None]","[0.75, 0.5, 0.5, 0.75]",[],脖子、尾巴长，头、腿中等长度。
1,87,"[None, None, None, None]","[None, None, None, None]","[None, None, None, None]","[None, None, None, None]","[None, None, None, None]","[0.5, 0.5, 0.25, 0.75]","[None, None, None, None]","[0.5, 0.5, 0.25, 0.75]",[],腿短，尾巴长，脖子、头中等长度。
1,88,"[None, None, None, None]","[None, None, None, None]","[None, None, None, None]","[None, None, None, None]","[None, None, None, None]","[0.5, 0.5, 0.75, 0.5]","[None, None, None, None]","[0.5, 0.5, 0.75, 0.5]",[],腿长，头、脖子、尾巴中等长度。
1,89,"[None, None, None, None]","[None, None, None, None]","[None, None, None, None]","[None, None, None, None]","[None, None, None, None]","[0.5, 0.5, 0.75, 0.25]","[None, None, None, None]","[0.5, 0.5, 0.75, 0.25]",[],尾巴短，腿长，头、脖子中等长度。
1,90,"[None, None, None, None]","[None, None, None, None]","[None, None, None, None]","[None, None, None, None]","[None, None, None, None]","[0.25, 0.75, 0.75, 0.75]","[None, None, None, None]","[0.25, 0.75, 0.75, 0.75]",[],头、尾巴、腿较长，脖子较短。
1,91,"[None, None, None, None]","[None, None, None, None]","[None, None, None, None]","[None, None, None, None]","[None, None, None, None]","[0.75, 0.75, 0.5, 0.5]","[None, None, None, None]","[0.75, 0.75, 0.5, 0.5]",[],头、脖子长，腿、尾巴中等长度。
1,92,"[None, None, None, None]","[None, None, None, None]","[None, None, None, None]","[None, None, None, None]","[None, None, None, None]","[0.5, 0.5, 0.5, 0.5]","[None, None, None, None]","[0.5, 0.5, 0.5, 0.5]",[],头、脖子、腿、尾巴中等长度。
1,93,"[None, None, None, None]","[None, None, None, None]","[None, None, None, None]","[None, None, None, None]","[None, None, None, None]","[0.75, 0.5, 0.5, 0.25]","[None, None, None, None]","[0.75, 0.5, 0.5, 0.25]",[],尾巴短，脖子长，头、腿中等长度。
1,94,"[None, None, None, None]","[None, None, None, None]","[None, None, None, None]","[None, None, None, None]","[None, None, None, None]","[0.5, 0.5, 0.5, 0.5]","[None, None, None, None]","[0.5, 0.5, 0.5, 0.5]",[],头、脖子、腿、尾巴中等长度。
1,95,"[None, None, None, None]","[None, None, None, None]","[None, None, None, None]","[None, None, None, None]","[None, None, None, None]","[0.75, 0.5, 0.5, 0.5]","[None, None, None, None]","[0.75, 0.5, 0.5, 0.5]",[],脖子长，头、腿、尾巴中等长度。
1,96,"[None, None, None, None]","[None, None, None, None]","[None, None, None, None]","[None, None, None, None]","[None, None, None, None]","[0.5, 0.5, 0.5, 0.5]","[None, None, None, None]","[0.5, 0.5, 0.5, 0.5]",[],头、脖子、腿、尾巴中等长度。
1,97,"[None, None, None, None]","[None, None, None, None]","[None, None, None, None]","[None, None, None, None]","[None, None, None, None]","[0.5, 0.25, 0.5, 0.75]","[None, None, None, None]","[0.5, 0.25, 0.5, 0.75]",[],头短，尾巴长，腿、脖子中等长度。
