exclusion,superlative,universal_quantifier,exclusive_case,comparison,general_case,addition,all,un_pro,origin
"[None, None, None, None]","[None, None, None, None]","[None, None, None, None]","[None, None, None, None]","[None, None, None, None]","[0.5, 0.5, 0.25, 0.5]","[None, None, None, None]","[0.5, 0.5, 0.25, 0.5]",[],腿短，头、脖子、尾巴中等长度。
"[None, None, None, None]","[None, None, None, None]","[None, None, None, None]","[None, None, None, None]","[None, None, None, None]","[0.75, 0.5, 0.25, 0.5]","[None, None, None, None]","[0.75, 0.5, 0.25, 0.5]",[],腿短，脖子长，头、尾巴中等长度。
"[None, None, None, None]","[None, None, None, None]","[None, None, None, None]","[None, None, None, None]","[None, None, None, None]","[0.5, 0.5, 0.25, 0.75]","[None, None, None, None]","[0.5, 0.5, 0.25, 0.75]",[],尾巴长，头、脖子中等长度，腿较短。
"[None, None, None, None]","[None, None, None, None]","[None, None, None, None]","[None, None, None, None]","[None, None, None, None]","[0.75, 0.25, 0.75, 0.5]","[None, None, None, None]","[0.75, 0.25, 0.75, 0.5]",[],腿、脖子长，尾巴中等长度，头短。
"[None, None, None, None]","[None, None, None, None]","[None, None, None, None]","[None, None, None, None]","[None, None, None, None]","[0.75, 0.5, 0.5, 0.5]","[None, None, None, None]","[0.75, 0.5, 0.5, 0.5]",[],脖子长，头、腿、尾巴中等长度。
"[None, None, None, None]","[None, None, None, None]","[None, None, None, None]","[None, None, None, None]","[None, None, None, None]","[None, 0.5, 0.375, 0.5]","[None, None, None, None]","[0.5, 0.5, 0.375, 0.5]",[],腿短，头、腿、尾巴中等长度。
"[None, None, None, None]","[None, None, None, None]","[None, None, None, None]","[None, None, None, None]","[None, None, None, None]","[0.75, 0.5, 0.25, 0.5]","[None, None, None, None]","[0.75, 0.5, 0.25, 0.5]",[],脖子较长，头、尾巴中等长度，腿较短。
"[None, None, None, None]","[None, None, None, None]","[None, None, None, None]","[None, None, None, None]","[None, None, None, None]","[0.5, 0.25, 0.5, 0.5]","[None, None, None, None]","[0.5, 0.25, 0.5, 0.5]",[],头短，脖子、腿、尾巴中等长度。
"[None, None, None, None]","[None, None, None, None]","[None, None, None, None]","[None, None, None, None]","[None, None, None, None]","[0.5, 0.5, 0.75, 0.5]","[None, None, None, None]","[0.5, 0.5, 0.75, 0.5]",[],腿长，头、脖子、尾巴中等长度。
"[None, None, None, None]","[None, None, None, None]","[None, None, None, None]","[None, None, None, None]","[None, None, None, None]","[0.5, 0.75, 0.75, 0.5]","[None, None, None, None]","[0.5, 0.75, 0.75, 0.5]",[],头、腿长，脖子、尾巴中等长度。
"[None, None, None, None]","[None, None, None, None]","[None, None, None, None]","[None, None, None, None]","[None, None, None, None]","[0.5, 0.5, 0.25, 0.75]","[None, None, None, None]","[0.5, 0.5, 0.25, 0.75]",[],尾巴长，头、脖子中等长度，腿较短。
"[None, None, None, None]","[None, None, None, None]","[None, None, None, None]","[None, None, None, None]","[None, None, None, None]","[0.25, 0.25, 0.75, 0.25]","[None, None, None, None]","[0.25, 0.25, 0.75, 0.25]",[],腿较长，头、脖子、尾巴较短。
"[None, None, None, None]","[None, None, None, None]","[None, None, None, None]","[None, None, None, None]","[None, None, None, None]","[0.25, 0.25, 0.75, 0.25]","[None, None, None, None]","[0.25, 0.25, 0.75, 0.25]",[],腿较长，头、脖子、尾巴较短。
"[None, None, None, None]","[None, None, None, None]","[None, None, None, None]","[None, None, None, None]","[None, None, None, None]","[0.75, 0.75, 0.5, 0.5]","[None, None, None, None]","[0.75, 0.75, 0.5, 0.5]",[],头、脖子较长，尾巴、腿中等长度。
"[None, None, None, None]","[None, None, None, None]","[None, None, None, None]","[None, None, None, None]","[None, None, None, None]","[0.5, 0.5, 0.25, 0.5]","[None, None, None, None]","[0.5, 0.5, 0.25, 0.5]",[],腿较短，头、脖子、尾巴中等长度。
"[None, None, None, None]","[None, None, None, None]","[None, None, None, None]","[None, None, None, None]","[None, None, None, None]","[0.5, 0.5, 0.5, 0.25]","[None, None, None, None]","[0.5, 0.5, 0.5, 0.25]",[],腿中等长度，尾巴较短，头、脖子中等长度。
"[None, None, None, None]","[None, None, None, None]","[None, None, None, None]","[None, None, None, None]","[None, None, None, None]","[0.25, 0.25, 0.75, 0.75]","[None, None, None, None]","[0.25, 0.25, 0.75, 0.75]",[],腿、尾巴长，头、脖子较短。
"[None, None, None, None]","[None, None, None, None]","[None, None, None, None]","[None, None, None, None]","[None, None, None, None]","[0.75, 0.75, 0.25, 0.25]","[None, None, None, None]","[0.75, 0.75, 0.25, 0.25]",[],头、脖子长，腿、尾巴短。
"[None, None, None, None]","[None, None, None, None]","[None, None, None, None]","[None, None, None, None]","[None, None, None, None]","[0.75, 0.75, 0.25, 0.25]","[None, None, None, None]","[0.75, 0.75, 0.25, 0.25]",[],头、脖子较长，腿、尾巴较短。
"[None, None, None, None]","[None, None, None, None]","[None, None, None, None]","[None, None, None, None]","[None, None, None, None]","[0.25, 0.75, 0.75, 0.25]","[None, None, None, None]","[0.25, 0.75, 0.75, 0.25]",[],脖子、尾巴较短，头、腿较长。
"[None, None, None, None]","[None, None, None, None]","[None, None, None, None]","[None, None, None, None]","[None, None, None, None]","[0.25, 0.25, 0.25, 0.75]","[None, None, None, None]","[0.25, 0.25, 0.25, 0.75]",[],头、脖子、腿较短，尾巴较长。
"[None, None, None, None]","[None, None, None, None]","[None, None, None, None]","[None, None, None, None]","[None, None, None, None]","[0.5, 0.75, 0.5, 0.5]","[None, None, None, None]","[0.5, 0.75, 0.5, 0.5]",[],头较长，脖子、尾巴、腿中等长度。
"[None, None, None, None]","[None, None, None, None]","[None, None, None, None]","[None, None, None, None]","[None, None, None, None]","[0.75, 0.75, 0.5, 0.5]","[None, None, None, None]","[0.75, 0.75, 0.5, 0.5]",[],头、脖子较长，尾巴、腿中等长度。
"[None, None, None, None]","[None, None, None, None]","[None, None, None, None]","[None, None, None, None]","[None, None, None, None]","[0.75, None, 0.25, 0.25]","[None, None, None, None]","[0.75, 0.5, 0.25, 0.25]",[],尾巴、腿较短，脖子较长。
"[None, None, None, None]","[None, None, None, None]","[None, None, None, None]","[None, None, None, None]","[None, None, None, None]","[0.75, 0.25, 0.75, 0.75]","[None, None, None, None]","[0.75, 0.25, 0.75, 0.75]",[],尾巴、腿、脖子较长，头短。
"[None, None, None, None]","[None, None, None, None]","[None, None, None, None]","[None, None, None, None]","[None, None, None, None]","[0.25, 0.5, 0.5, 0.5]","[None, None, None, None]","[0.25, 0.5, 0.5, 0.5]",[],尾巴、腿、头中等长度，脖子较短。
"[None, None, None, None]","[None, None, None, None]","[None, None, None, None]","[None, None, None, None]","[None, None, None, None]","[0.5, 0.75, 0.5, 0.5]","[None, None, None, None]","[0.5, 0.75, 0.5, 0.5]",[],头较长，脖子、腿、尾巴中等长度。
"[None, None, None, None]","[None, None, None, None]","[None, None, None, None]","[None, None, None, None]","[None, None, None, None]","[0.75, 0.75, 0.25, 0.75]","[None, None, None, None]","[0.75, 0.75, 0.25, 0.75]",[],头、脖子、尾巴较长，腿较短。
"[None, None, None, None]","[None, None, None, None]","[None, None, None, None]","[None, None, None, None]","[None, None, None, None]","[0.5, 0.5, 0.75, 0.25]","[None, None, None, None]","[0.5, 0.5, 0.75, 0.25]",[],尾巴短，腿长，脖子、头中等长度。
"[None, None, None, None]","[None, None, None, None]","[None, None, None, None]","[None, None, None, None]","[None, None, None, None]","[0.75, 0.75, 0.25, 0.75]","[None, None, None, None]","[0.75, 0.75, 0.25, 0.75]",[],头、脖子、尾巴较长，腿短。
"[None, None, None, None]","[None, None, None, None]","[None, None, None, None]","[None, None, None, None]","[None, None, None, None]","[0.75, 0.25, 0.5, 0.75]","[None, None, None, None]","[0.75, 0.25, 0.5, 0.75]",[],脖子、尾巴长，腿中等长度，头较短。
"[None, None, None, None]","[None, None, None, None]","[None, None, None, None]","[None, None, None, None]","[None, None, None, None]","[0.5, 0.5, 0.25, 0.5]","[None, None, None, None]","[0.5, 0.5, 0.25, 0.5]",[],腿短，尾巴、脖子、头中等长度。
"[None, None, None, None]","[None, None, None, None]","[None, None, None, None]","[None, None, None, None]","[None, None, None, None]","[0.5, 0.5, 0.25, 0.5]","[None, None, None, None]","[0.5, 0.5, 0.25, 0.5]",[],腿短，尾巴、脖子、头中等长度。
"[None, None, None, None]","[None, None, None, None]","[None, None, None, None]","[None, None, None, None]","[None, None, None, None]","[0.75, 0.75, 0.75, 0.25]","[None, None, None, None]","[0.75, 0.75, 0.75, 0.25]",[],尾巴短，腿、脖子、头较长。
"[None, None, None, None]","[None, None, None, None]","[None, None, None, None]","[None, None, None, None]","[None, None, None, None]","[0.5, 0.25, 0.5, 0.5]","[None, None, None, None]","[0.5, 0.25, 0.5, 0.5]",[],头较短，腿、尾巴、脖子中等长度。
"[None, None, None, None]","[None, None, None, None]","[None, None, None, None]","[None, None, None, None]","[None, None, None, None]","[0.5, 0.5, 0.5, 0.25]","[None, None, None, None]","[0.5, 0.5, 0.5, 0.25]",[],尾巴短，腿、脖子、头中等长度。
"[None, None, None, None]","[None, None, None, None]","[None, None, None, None]","[None, None, None, None]","[None, None, None, None]","[0.5, 0.5, 0.75, 0.5]","[None, None, None, None]","[0.5, 0.5, 0.75, 0.5]",[],腿较长，头、脖子、尾巴中等长度。
"[None, None, None, None]","[None, None, None, None]","[None, None, None, None]","[None, None, None, None]","[None, None, None, None]","[0.5, 0.75, 0.75, 0.5]","[None, None, None, None]","[0.5, 0.75, 0.75, 0.5]",[],头、腿较长，脖子、尾巴中等长度。
"[None, None, None, None]","[None, None, None, None]","[None, None, None, None]","[None, None, None, None]","[None, None, None, None]","[0.5, 0.5, 0.25, 0.5]","[None, None, None, None]","[0.5, 0.5, 0.25, 0.5]",[],腿短，尾巴、脖子、头中等长度。
"[None, None, None, None]","[None, None, None, None]","[None, None, None, None]","[None, None, None, None]","[None, None, None, None]","[0.25, 0.75, 0.5, 0.5]","[None, None, None, None]","[0.25, 0.75, 0.5, 0.5]",[],尾巴、腿中等长度，头较长，脖子较短。
"[None, None, None, None]","[None, None, None, None]","[None, None, None, None]","[None, None, None, None]","[None, None, None, None]","[0.25, 0.75, 0.25, 0.75]","[None, None, None, None]","[0.25, 0.75, 0.25, 0.75]",[],腿、脖子较短，尾巴、头较长。
"[None, None, None, None]","[None, None, None, None]","[None, None, None, None]","[None, None, None, None]","[None, None, None, None]","[0.75, 0.75, 0.25, 0.25]","[None, None, None, None]","[0.75, 0.75, 0.25, 0.25]",[],腿、尾巴较短，头、脖子较长。
"[None, None, None, None]","[None, None, None, None]","[None, None, None, None]","[None, None, None, None]","[None, None, None, None]","[None, None, None, 0.75]","[None, None, None, None]","[0.5, 0.5, 0.5, 0.75]",[],尾巴较长。
"[None, None, None, None]","[None, None, None, None]","[None, None, None, None]","[None, None, None, None]","[None, None, None, None]","[None, None, 0.75, 0.25]","[None, None, None, None]","[0.5, 0.5, 0.75, 0.25]",[],尾巴较短，腿较长。
"[None, None, None, None]","[None, None, None, None]","[None, None, None, None]","[None, None, None, None]","[None, None, None, None]","[0.75, 0.25, 0.5, 0.5]","[None, None, None, None]","[0.75, 0.25, 0.5, 0.5]",[],脖子较长，头较短，腿、尾巴中等长度。
"[None, None, None, None]","[None, None, None, None]","[None, None, None, None]","[None, None, None, None]","[None, None, None, None]","[None, None, None, 0.75]","[None, None, None, None]","[0.5, 0.5, 0.5, 0.75]",[],尾巴较长。
"[None, None, None, None]","[None, None, None, None]","[None, None, None, None]","[None, None, None, None]","[None, None, None, None]","[None, None, None, 0.75]","[None, None, None, None]","[0.5, 0.5, 0.5, 0.75]",[],尾巴较长。
"[None, None, None, None]","[None, None, None, None]","[None, None, None, None]","[None, None, None, None]","[None, None, None, None]","[None, None, None, 0.75]","[None, None, None, None]","[0.5, 0.5, 0.5, 0.75]",[],尾巴较长。
"[None, None, None, None]","[None, None, None, None]","[None, None, None, None]","[None, None, None, None]","[None, None, None, None]","[0.5, 0.5, 0.25, 0.25]","[None, None, None, None]","[0.5, 0.5, 0.25, 0.25]",[],腿、尾巴较短，脖子、头中等长度。
"[None, None, None, None]","[None, None, None, None]","[None, None, None, None]","[None, None, None, None]","[None, None, None, None]","[0.75, 0.75, 0.25, 0.25]","[None, None, None, None]","[0.75, 0.75, 0.25, 0.25]",[],腿、尾巴较短，头、脖子较长。
"[None, None, None, None]","[None, None, None, None]","[None, None, None, None]","[None, None, None, None]","[None, None, None, None]","[0.75, 0.25, 0.25, 0.25]","[None, None, None, None]","[0.75, 0.25, 0.25, 0.25]",[],脖子较长，头、腿、尾巴较短。
"[None, None, None, None]","[None, None, None, None]","[None, None, None, None]","[None, None, None, None]","[None, None, None, None]","[0.25, 0.75, 0.75, 0.25]","[None, None, None, None]","[0.25, 0.75, 0.75, 0.25]",[],头、腿较长，脖子、尾巴较短。
"[None, None, None, None]","[None, None, None, None]","[None, None, None, None]","[None, None, None, None]","[None, None, None, None]","[0.25, 0.75, 0.75, 0.25]","[None, None, None, None]","[0.25, 0.75, 0.75, 0.25]",[],脖子、尾巴较短，头、腿略长。
"[None, None, None, None]","[None, None, None, None]","[None, None, None, None]","[None, None, None, None]","[None, None, None, None]","[0.25, 0.25, 0.75, 0.75]","[None, None, None, None]","[0.25, 0.25, 0.75, 0.75]",[],腿、尾巴长，头、脖子短。
"[None, None, None, None]","[None, None, None, None]","[None, None, None, None]","[None, None, None, None]","[None, None, None, None]","[0.25, 0.25, 0.75, 0.75]","[None, None, None, None]","[0.25, 0.25, 0.75, 0.75]",[],腿、尾巴长，头、脖子较短。
"[None, None, None, None]","[None, None, None, None]","[None, None, None, None]","[None, None, None, None]","[None, None, None, None]","[0.75, 0.25, 0.25, 0.25]","[None, None, None, None]","[0.75, 0.25, 0.25, 0.25]",[],尾巴、腿头短，脖子略长。
"[None, None, None, None]","[None, None, None, None]","[None, None, None, None]","[None, None, None, None]","[None, None, None, None]","[0.5, 0.5, 0.25, 0.5]","[None, None, None, None]","[0.5, 0.5, 0.25, 0.5]",[],腿短，头、脖子、尾巴中等长度。
"[None, None, None, None]","[None, None, None, None]","[None, None, None, None]","[None, None, None, None]","[None, None, None, None]","[0.5, 0.75, 0.5, 0.75]","[None, None, None, None]","[0.5, 0.75, 0.5, 0.75]",[],尾巴长，头长，脖子、腿中等长度。
"[None, None, None, None]","[None, None, None, None]","[None, None, None, None]","[None, None, None, None]","[None, None, None, None]","[0.75, None, 0.75, 0.25]","[None, None, None, None]","[0.75, 0.5, 0.75, 0.25]",[],尾巴短，脖子、腿较长。
"[None, None, None, None]","[None, None, None, None]","[None, None, None, None]","[None, None, None, None]","[None, None, None, None]","[0.75, 0.75, 0.25, 0.25]","[None, None, None, None]","[0.75, 0.75, 0.25, 0.25]",[],尾巴、腿较短，头、脖子较长。
"[None, None, None, None]","[None, None, None, None]","[None, None, None, None]","[None, None, None, None]","[None, None, None, None]","[0.25, 0.75, 0.75, 0.75]","[None, None, None, None]","[0.25, 0.75, 0.75, 0.75]",[],尾巴、腿头较长，脖子较短。
"[None, None, None, None]","[None, None, None, None]","[None, None, None, None]","[None, None, None, None]","[None, None, None, None]","[0.5, 0.5, 0.5, 0.75]","[None, None, None, None]","[0.5, 0.5, 0.5, 0.75]",[],尾巴较长，腿、头、脖子中等长度。
"[None, None, None, None]","[None, None, None, None]","[None, None, None, None]","[None, None, None, None]","[None, None, None, None]","[0.75, 0.75, 0.25, 0.75]","[None, None, None, None]","[0.75, 0.75, 0.25, 0.75]",[],尾巴、头、脖子较长，腿短。
"[None, None, None, None]","[None, None, None, None]","[None, None, None, None]","[None, None, None, None]","[None, None, None, None]","[0.25, 0.75, 0.75, 0.75]","[None, None, None, None]","[0.25, 0.75, 0.75, 0.75]",[],尾巴、腿、头较长，脖子较短。
"[None, None, None, None]","[None, None, None, None]","[None, None, None, None]","[None, None, None, None]","[None, None, None, None]","[0.5, 0.5, 0.5, 0.75]","[None, None, None, None]","[0.5, 0.5, 0.5, 0.75]",[],尾巴较长，头、脖子、腿中等长度。
"[None, None, None, None]","[None, None, None, None]","[None, None, None, None]","[None, None, None, None]","[None, None, None, None]","[0.5, 0.5, 0.25, 0.25]","[None, None, None, None]","[0.5, 0.5, 0.25, 0.25]",[],尾巴、腿短，头、脖子中等长度。
"[None, None, None, None]","[None, None, None, None]","[None, None, None, None]","[None, None, None, None]","[None, None, None, None]","[0.75, 0.25, 0.25, 0.25]","[None, None, None, None]","[0.75, 0.25, 0.25, 0.25]",[],头、腿、尾巴较短，脖子较长。
"[None, None, None, None]","[None, None, None, None]","[None, None, None, None]","[None, None, None, None]","[None, None, None, None]","[0.25, 0.75, 0.25, 0.25]","[None, None, None, None]","[0.25, 0.75, 0.25, 0.25]",[],尾巴、腿、脖子较短，头较长。
"[None, None, None, None]","[None, None, None, None]","[None, None, None, None]","[None, None, None, None]","[None, None, None, None]","[0.75, 0.5, 0.5, 0.5]","[None, None, None, None]","[0.75, 0.5, 0.5, 0.5]",[],脖子较长，头、腿、尾巴中等长度。
"[None, None, None, None]","[None, None, None, None]","[None, None, None, None]","[None, None, None, None]","[None, None, None, None]","[0.25, 0.25, 0.75, 0.25]","[None, None, None, None]","[0.25, 0.25, 0.75, 0.25]",[],尾巴、头、脖子短，腿较长。
"[None, None, None, None]","[None, None, None, None]","[None, None, None, None]","[None, None, None, None]","[None, None, None, None]","[0.5, 0.5, 0.5, 0.5]","[None, None, None, None]","[0.5, 0.5, 0.5, 0.5]",[],尾巴、腿、头、脖子中等长度。
"[None, None, None, None]","[None, None, None, None]","[None, None, None, None]","[None, None, None, None]","[None, None, None, None]","[None, None, None, 0.75]","[None, None, None, None]","[0.5, 0.5, 0.5, 0.75]",[],尾巴较长。
"[None, None, None, None]","[None, None, None, None]","[None, None, None, None]","[None, None, None, None]","[None, None, None, None]","[None, None, None, 0.75]","[None, None, None, None]","[0.5, 0.5, 0.5, 0.75]",[],尾巴较长。
"[None, None, None, None]","[None, None, None, None]","[None, None, None, None]","[None, None, None, None]","[None, None, None, None]","[None, None, None, 0.75]","[None, None, None, None]","[0.5, 0.5, 0.5, 0.75]",[],尾巴较长。
"[None, None, None, None]","[None, None, None, None]","[None, None, None, None]","[None, None, None, None]","[None, None, None, None]","[None, None, None, 0.75]","[None, None, None, None]","[0.5, 0.5, 0.5, 0.75]",[],尾巴较长。
"[None, None, None, None]","[None, None, None, None]","[None, None, None, None]","[None, None, None, None]","[None, None, None, None]","[None, None, None, 0.25]","[None, None, None, None]","[0.5, 0.5, 0.5, 0.25]",[],尾巴较短。
"[None, None, None, None]","[None, None, None, None]","[None, None, None, None]","[None, None, None, None]","[None, None, None, None]","[None, None, None, 0.25]","[None, None, None, None]","[0.5, 0.5, 0.5, 0.25]",[],尾巴较短。
"[None, None, None, None]","[None, None, None, None]","[None, None, None, None]","[None, None, None, None]","[None, None, None, None]","[None, None, None, 0.25]","[None, None, None, None]","[0.5, 0.5, 0.5, 0.25]",[],尾巴短。
"[None, None, None, None]","[None, None, None, None]","[None, None, None, None]","[None, None, None, None]","[None, None, None, None]","[0.75, 0.75, None, 0.25]","[None, None, None, None]","[0.75, 0.75, 0.5, 0.25]",[],尾巴短，头、脖子长。
"[None, None, None, None]","[None, None, None, None]","[None, None, None, None]","[None, None, None, None]","[None, None, None, None]","[None, None, None, 0.75]","[None, None, None, None]","[0.5, 0.5, 0.5, 0.75]",[],尾巴长。
"[None, None, None, None]","[None, None, None, None]","[None, None, None, None]","[None, None, None, None]","[None, None, None, None]","[None, None, None, 0.25]","[None, None, None, None]","[0.5, 0.5, 0.5, 0.25]",[],尾巴短。
"[None, None, None, None]","[None, None, None, None]","[None, None, None, None]","[None, None, None, None]","[None, None, None, None]","[None, None, None, 0.25]","[None, None, None, None]","[0.5, 0.5, 0.5, 0.25]",[],尾巴短。
"[None, None, None, None]","[None, None, None, None]","[None, None, None, None]","[None, None, None, None]","[None, None, None, None]","[None, None, None, 0.25]","[None, None, None, None]","[0.5, 0.5, 0.5, 0.25]",[],尾巴短。
"[None, None, None, None]","[None, None, None, None]","[None, None, None, None]","[None, None, None, None]","[None, None, None, None]","[None, None, None, 0.25]","[None, None, None, None]","[0.5, 0.5, 0.5, 0.25]",[],尾巴较短。
"[None, None, None, None]","[None, None, None, None]","[None, None, None, None]","[None, None, None, None]","[None, None, None, None]","[None, None, None, 0.25]","[None, None, None, None]","[0.5, 0.5, 0.5, 0.25]",[],尾巴较短。
"[None, None, None, None]","[None, None, None, None]","[None, None, None, None]","[None, None, None, None]","[None, None, None, None]","[0.5, 0.5, 0.5, 0.25]","[None, None, None, None]","[0.5, 0.5, 0.5, 0.25]",[],尾巴较短，腿中等长度，脖子、头中等长度。
"[None, None, None, None]","[None, None, None, None]","[None, None, None, None]","[None, None, None, None]","[None, None, None, None]","[0.75, 0.75, 0.25, 0.75]","[None, None, None, None]","[0.75, 0.75, 0.25, 0.75]",[],腿短，尾巴、脖子、头较长。
"[None, None, None, None]","[None, None, None, None]","[None, None, None, None]","[None, None, None, None]","[None, None, None, None]","[None, None, 0.5, 0.75]","[None, None, None, None]","[0.5, 0.5, 0.5, 0.75]",[],尾巴长，腿、尾巴长，腿较短。
"[None, None, None, None]","[None, None, None, None]","[None, None, None, None]","[None, None, None, None]","[None, None, None, None]","[0.25, 0.5, 0.75, 0.75]","[None, None, None, None]","[0.25, 0.5, 0.75, 0.75]",[],尾巴长，腿较长，脖子较短，头中等长度。
"[None, None, None, None]","[None, None, None, None]","[None, None, None, None]","[None, None, None, None]","[None, None, None, None]","[0.5, 0.5, 0.5, 0.75]","[None, None, None, None]","[0.5, 0.5, 0.5, 0.75]",[],尾巴长，腿、头、脖子中等长度。
"[None, None, None, None]","[None, None, None, None]","[None, None, None, None]","[None, None, None, None]","[None, None, None, None]","[0.5, 0.5, 0.5, 0.75]","[None, None, None, None]","[0.5, 0.5, 0.5, 0.75]",[],尾巴长，头、脖子、腿中等长度。
"[None, None, None, None]","[None, None, None, None]","[None, None, None, None]","[None, None, None, None]","[None, None, None, None]","[0.75, 0.75, 0.75, 0.75]","[None, None, None, None]","[0.75, 0.75, 0.75, 0.75]",[],尾巴较长，腿、脖子、头较长。
"[None, None, None, None]","[None, None, None, None]","[None, None, None, None]","[None, None, None, None]","[None, None, None, None]","[0.5, 0.5, 0.25, 0.75]","[None, None, None, None]","[0.5, 0.5, 0.25, 0.75]",[],尾巴较长，腿短，头、脖子中等长度。
"[None, None, None, None]","[None, None, None, None]","[None, None, None, None]","[None, None, None, None]","[None, None, None, None]","[0.25, 0.25, 0.25, 0.25]","[None, None, None, None]","[0.25, 0.25, 0.25, 0.25]",[],尾巴较短，腿、头、脖子较短。
