iSession,iTrial,exclusion,superlative,universal_quantifier,exclusive_case,comparison,general_case,addition,all,un_pro,text
1,1,"[None, None, None, None]","[None, None, None, None]","[None, None, None, None]","[None, None, None, None]","[None, None, None, None]","[0.75, 0.25, 0.75, 0.25]","[None, None, None, None]","[0.75, 0.25, 0.75, 0.25]",[],脖子和腿长，头和尾巴短。
1,2,"[None, None, None, None]","[None, None, None, None]","[None, None, None, None]","[None, None, None, None]","[None, None, None, None]","[0.25, None, 0.25, None]","[None, None, None, None]","[0.25, 0.5, 0.25, 0.5]",[],脖子、腿短。
1,3,"[None, None, None, None]","[None, None, None, None]","[None, None, None, None]","[None, None, None, None]","[None, None, None, None]","[None, None, 0.25, 0.25]","[None, None, None, None]","[0.5, 0.5, 0.25, 0.25]",[],腿短，尾巴短。
1,4,"[None, None, None, None]","[None, None, None, None]","[None, None, None, None]","[None, None, None, None]","[None, None, None, None]","[0.25, None, 0.75, None]","[None, None, None, None]","[0.25, 0.5, 0.75, 0.5]",[],腿长，脖子短。
1,5,"[None, None, None, None]","[None, None, None, None]","[None, None, None, None]","[None, None, None, None]","[None, None, None, None]","[None, None, 0.25, 0.25]","[None, None, None, None]","[0.5, 0.5, 0.25, 0.25]",[],腿短，尾巴短。
1,6,"[None, None, None, None]","[None, None, None, None]","[None, None, None, None]","[None, None, None, None]","[None, None, None, None]","[None, None, 0.25, None]","[None, None, None, None]","[0.5, 0.5, 0.25, 0.5]",[],腿短。
1,7,"[None, None, None, None]","[None, None, None, None]","[None, None, None, None]","[None, None, None, None]","[None, None, None, None]","[None, 0.25, None, None]","[None, None, None, None]","[0.5, 0.25, 0.5, 0.5]",[],头短。
1,8,"[None, None, None, None]","[None, None, None, None]","[None, None, None, None]","[None, None, None, None]","[None, None, None, None]","[0.75, 0.75, 0.75, None]","[None, None, None, None]","[0.75, 0.75, 0.75, 0.5]",[],腿、脖子、头长。
1,9,"[None, None, None, None]","[None, None, None, None]","[None, None, None, None]","[None, None, None, None]","[None, None, None, None]","[None, 0.75, None, 0.75]","[None, None, None, None]","[0.5, 0.75, 0.5, 0.75]",[],尾巴头长。
1,10,"[None, None, None, None]","[None, None, None, None]","[None, None, None, None]","[None, None, None, None]","[None, None, None, None]","[0.25, None, None, None]","[None, None, None, None]","[0.25, 0.5, 0.5, 0.5]",[],脖子短。
1,11,"[None, None, None, None]","[None, None, None, None]","[None, None, None, None]","[None, None, None, None]","[None, None, None, None]","[None, None, None, 0.25]","[None, None, None, None]","[0.5, 0.5, 0.5, 0.25]",[],尾巴短。
1,12,"[None, None, None, None]","[0.8, 0.8, 0.8, 0.4]","[None, None, None, None]","[None, None, None, None]","[None, None, None, None]","[0.75, 0.25, 0.25, None]","[None, None, None, None]","[0.775, 0.525, 0.525, 0.4]",[],脖子长，头和腿较短，尾巴最短。
1,13,"[None, None, None, None]","[None, None, None, None]","[None, None, None, None]","[None, None, None, None]","[None, None, None, None]","[None, None, None, 0.25]","[None, None, None, None]","[0.5, 0.5, 0.5, 0.25]",['头和脖子一样长'],尾巴短，头和脖子一样长。
1,14,"[None, None, None, None]","[None, None, None, None]","[None, None, None, None]","[None, None, None, None]","[None, None, None, None]","[0.75, None, 0.75, 0.25]","[None, None, None, None]","[0.75, 0.5, 0.75, 0.25]",[],尾巴短，腿和脖子较长。
1,15,"[None, None, None, None]","[None, None, None, None]","[None, None, None, None]","[None, None, None, None]","[None, None, None, None]","[None, 0.75, 0.25, 0.75]","[None, None, None, None]","[0.5, 0.75, 0.25, 0.75]",[],头和尾巴长，腿短。
1,16,"[None, None, None, None]","[0.4, 0.4, 0.4, 0.8]","[None, None, None, None]","[None, None, None, None]","[None, None, None, None]","[None, None, 0.75, None]","[None, None, None, None]","[0.4, 0.4, 0.575, 0.8]",['头和脖子一样长'],头和脖子一样长，腿较长，尾巴最长。
1,17,"[None, None, None, None]","[None, None, None, None]","[None, None, None, None]","[None, None, None, None]","[None, None, None, None]","[None, None, None, 0.75]","[None, None, None, None]","[0.5, 0.5, 0.5, 0.75]",[],尾巴长于其他部位。
1,18,"[None, None, None, None]","[None, None, None, None]","[None, None, None, None]","[None, None, None, None]","[None, None, None, None]","[None, None, None, None]","[None, None, None, None]","[None, None, None, None]",['头和脖子一样长'],头和脖子一样长。
1,19,"[None, None, None, None]","[None, None, None, None]","[None, None, None, None]","[None, None, None, None]","[None, None, None, None]","[0.25, None, None, None]","[None, None, None, None]","[0.25, 0.5, 0.5, 0.5]",[],脖子短。
1,20,"[None, None, None, None]","[None, None, None, None]","[None, None, None, None]","[None, None, None, None]","[None, None, None, None]","[None, None, 0.75, None]","[None, None, None, None]","[0.5, 0.5, 0.75, 0.5]",[],腿长。
1,21,"[None, None, None, None]","[None, None, None, None]","[None, None, None, None]","[None, None, None, None]","[None, None, None, None]","[None, None, None, None]","[None, None, None, None]","[None, None, None, None]",['头、脖子、尾巴、腿差不多长'],头、脖子、尾巴、腿差不多长。
1,22,"[None, None, None, None]","[None, None, None, None]","[None, None, None, None]","[None, None, None, None]","[None, None, None, None]","[0.25, None, 0.25, 0.75]","[None, None, None, None]","[0.25, 0.5, 0.25, 0.75]",['头'],尾巴长，头，腿和脖子比较短。
1,23,"[None, None, None, None]","[None, None, None, None]","[None, None, None, None]","[None, None, None, None]","[None, None, None, None]","[None, None, 0.25, 0.25]","[None, None, None, None]","[0.5, 0.5, 0.25, 0.25]",['头、脖子差不多长'],头、脖子差不多长，腿和尾巴较短。
1,24,"[None, None, None, None]","[0.8, 0.8, 0.4, 0.8]","[None, None, None, None]","[None, None, None, None]","[None, None, None, None]","[0.75, 0.75, None, 0.75]","[None, None, None, None]","[0.775, 0.775, 0.4, 0.775]",[],头、脖子、尾巴都比较长，腿最短。
1,25,"[None, None, None, None]","[None, None, None, None]","[None, None, None, None]","[None, None, None, None]","[None, None, None, None]","[0.75, 0.25, 0.75, 0.75]","[None, None, None, None]","[0.75, 0.25, 0.75, 0.75]",[],脖子、腿、尾巴长，头较短。
1,26,"[None, None, None, None]","[None, None, None, None]","[None, None, None, None]","[None, None, None, None]","[None, None, None, None]","[None, 0.75, None, None]","[None, None, None, None]","[0.5, 0.75, 0.5, 0.5]",[],头长。
1,27,"[None, None, None, None]","[None, None, None, None]","[None, None, None, None]","[None, None, None, None]","[None, None, None, None]","[None, None, 0.75, None]","[None, None, None, None]","[0.5, 0.5, 0.75, 0.5]",[],腿长。
1,28,"[None, None, None, None]","[None, None, None, None]","[None, None, None, None]","[None, None, None, None]","[None, None, None, None]","[None, 0.75, None, None]","[None, None, None, None]","[0.5, 0.75, 0.5, 0.5]",[],头长。
1,29,"[None, None, None, None]","[None, None, None, None]","[None, None, None, None]","[None, None, None, None]","[None, None, None, None]","[None, None, None, None]","[None, None, None, None]","[None, None, None, None]",['头和脖子一样长'],头和脖子一样长。
1,30,"[None, None, None, None]","[None, None, None, None]","[None, None, None, None]","[None, None, None, None]","[None, None, None, None]","[None, None, 0.75, None]","[None, None, None, None]","[0.5, 0.5, 0.75, 0.5]",[],腿长。
1,31,"[None, None, None, None]","[None, None, None, None]","[None, None, None, None]","[None, None, None, None]","[None, None, None, None]","[None, None, None, None]","[None, None, None, None]","[None, None, None, None]",['脖子、腿、尾巴差不多长'],脖子、腿、尾巴差不多长。
1,32,"[None, None, None, None]","[None, None, None, None]","[None, None, None, None]","[None, None, None, None]","[None, None, None, None]","[None, 0.75, None, None]","[None, None, None, None]","[0.5, 0.75, 0.5, 0.5]",[],头长。
1,33,"[None, None, None, None]","[None, None, None, None]","[None, None, None, None]","[None, None, None, None]","[None, None, None, None]","[0.75, None, None, None]","[None, None, None, None]","[0.75, 0.5, 0.5, 0.5]",[],脖子较长。
1,34,"[None, None, None, None]","[None, None, None, None]","[None, None, None, None]","[None, None, None, None]","[None, None, None, None]","[None, None, 0.75, None]","[None, None, None, None]","[0.5, 0.5, 0.75, 0.5]",[],腿较长。
1,35,"[None, None, None, None]","[None, None, None, None]","[None, None, None, None]","[None, None, None, None]","[None, None, None, None]","[0.75, 0.75, 0.25, 0.25]","[None, None, None, None]","[0.75, 0.75, 0.25, 0.25]",[],头、脖子较长，腿、尾巴短。
1,36,"[None, None, None, None]","[None, None, None, None]","[None, None, None, None]","[None, None, None, None]","[None, None, None, None]","[0.25, None, None, 0.25]","[None, None, None, None]","[0.25, 0.5, 0.5, 0.25]",[],脖子、尾巴短。
1,37,"[None, None, None, None]","[0.4, 0.8, 0.4, 0.4]","[None, None, None, None]","[None, None, None, None]","[None, None, None, None]","[None, None, None, None]","[None, None, None, None]","[0.4, 0.8, 0.4, 0.4]",[],头最长。
1,38,"[None, None, None, None]","[0.4, 0.4, 0.8, 0.4]","[None, None, None, None]","[None, None, None, None]","[None, None, None, None]","[None, None, None, None]","[None, None, None, None]","[0.4, 0.4, 0.8, 0.4]",[],腿最长。
1,39,"[None, None, None, None]","[0.8, 0.8, 0.4, 0.8]","[None, None, None, None]","[None, None, None, None]","[None, None, None, None]","[0.25, 0.75, None, None]","[None, None, None, None]","[0.525, 0.775, 0.4, 0.8]",[],头长，脖子短，腿最短。
1,40,"[None, None, None, None]","[None, None, None, None]","[None, None, None, None]","[None, None, None, None]","[None, None, None, None]","[0.75, None, None, None]","[None, None, None, None]","[0.75, 0.5, 0.5, 0.5]",[],脖子长。
1,41,"[None, None, None, None]","[None, None, None, None]","[None, None, None, None]","[None, None, None, None]","[None, None, None, None]","[None, 0.75, None, None]","[None, None, None, None]","[0.5, 0.75, 0.5, 0.5]",[],头长。
1,42,"[None, None, None, None]","[None, None, None, None]","[None, None, None, None]","[None, None, None, None]","[None, None, None, None]","[None, None, None, 0.75]","[None, None, None, None]","[0.5, 0.5, 0.5, 0.75]",[],尾巴长。
1,43,"[None, None, None, None]","[None, None, None, None]","[None, None, None, None]","[None, None, None, None]","[None, None, None, None]","[None, 0.75, None, None]","[None, None, None, None]","[0.5, 0.75, 0.5, 0.5]",[],头长。
1,44,"[None, None, None, None]","[None, None, None, None]","[None, None, None, None]","[None, None, None, None]","[None, None, None, None]","[None, None, None, None]","[None, None, None, None]","[None, None, None, None]",['头、脖子差不多长'],头、脖子差不多长。
1,45,"[None, None, None, None]","[None, None, None, None]","[None, None, None, None]","[None, None, None, None]","[None, None, None, None]","[None, None, 0.25, None]","[None, None, None, None]","[0.5, 0.5, 0.25, 0.5]",['脖子和尾巴差不多长'],腿短，脖子和尾巴差不多长。
1,46,"[None, None, None, None]","[0.8, 0.4, 0.4, 0.4]","[None, None, None, None]","[None, None, None, None]","[None, None, None, None]","[None, None, None, None]","[None, None, None, None]","[0.8, 0.4, 0.4, 0.4]",['头和尾巴差不多长'],脖子最长，头和尾巴差不多长。
1,47,"[None, None, None, None]","[None, None, None, None]","[None, None, None, None]","[None, None, None, None]","[None, None, None, None]","[None, None, None, None]","[None, None, None, None]","[None, None, None, None]",['头、尾巴差不多长'],头、尾巴差不多长。
1,48,"[None, None, None, None]","[None, None, None, None]","[None, None, None, None]","[None, None, None, None]","[None, None, None, None]","[None, 0.25, 0.25, 0.25]","[None, None, None, None]","[0.5, 0.25, 0.25, 0.25]",[],头、腿和尾巴较短。
1,49,"[None, None, None, None]","[None, None, None, None]","[None, None, None, None]","[None, None, None, None]","[None, None, None, None]","[None, None, 0.75, None]","[None, None, None, None]","[0.5, 0.5, 0.75, 0.5]",[],腿长。
1,50,"[None, None, None, None]","[None, None, None, None]","[None, None, None, None]","[None, None, None, None]","[None, None, None, None]","[None, None, None, None]","[None, None, None, None]","[None, None, None, None]",['四个部位长度不一'],四个部位长度不一。
1,51,"[None, None, None, None]","[None, None, None, None]","[None, None, None, None]","[None, None, None, None]","[None, None, None, None]","[None, None, None, None]","[None, None, None, None]","[None, None, None, None]","['头和脖子差不多长', '腿和尾巴差不多长']",头和脖子差不多长，腿和尾巴差不多长。
1,52,"[None, None, None, None]","[None, None, None, None]","[None, None, None, None]","[None, None, None, None]","[None, None, None, None]","[None, None, 0.75, None]","[None, None, None, None]","[0.5, 0.5, 0.75, 0.5]",[],腿长。
1,53,"[0.25, 0.75, 0.75, 0.75]","[None, None, None, None]","[None, None, None, None]","[None, None, None, None]","[None, None, None, None]","[None, None, None, None]","[None, None, None, None]","[0.25, 0.75, 0.75, 0.75]",['且差不多长'],脖子短，其余三个部位较长，且差不多长。
1,54,"[None, None, None, None]","[None, None, None, None]","[None, None, None, None]","[None, None, None, None]","[None, None, None, None]","[0.75, 0.25, 0.75, 0.25]","[None, None, None, None]","[0.75, 0.25, 0.75, 0.25]",[],头、尾巴较短，脖子和腿较长。
1,55,"[None, None, None, None]","[None, None, None, None]","[None, None, None, None]","[None, None, None, None]","[None, None, None, None]","[None, None, None, None]","[None, None, None, None]","[None, None, None, None]",['头、尾巴一样长'],头、尾巴一样长。
1,56,"[None, None, None, None]","[None, None, None, None]","[None, None, None, None]","[None, None, None, None]","[None, None, None, None]","[None, None, None, None]","[None, None, None, None]","[None, None, None, None]",['头、尾巴一样长'],头、尾巴一样长。
1,57,"[None, None, None, None]","[None, None, None, None]","[None, None, None, None]","[None, None, None, None]","[None, None, None, None]","[None, 0.75, None, None]","[None, None, None, None]","[0.5, 0.75, 0.5, 0.5]",[],头长。
1,58,"[None, None, None, None]","[None, None, None, None]","[None, None, None, None]","[None, None, None, None]","[None, None, None, None]","[0.25, None, None, None]","[None, None, None, None]","[0.25, 0.5, 0.5, 0.5]",[],脖子短。
1,59,"[None, None, None, None]","[None, None, None, None]","[None, None, None, None]","[None, None, None, None]","[None, None, None, None]","[None, 0.75, 0.25, 0.25]","[None, None, None, None]","[0.5, 0.75, 0.25, 0.25]",[],头长，腿、尾巴短。
1,60,"[None, None, None, None]","[None, None, None, None]","[None, None, None, None]","[None, None, None, None]","[None, None, None, None]","[0.75, None, None, 0.75]","[None, None, None, None]","[0.75, 0.5, 0.5, 0.75]",[],脖子、尾巴长。
1,61,"[None, None, None, None]","[None, None, None, None]","[None, None, None, None]","[None, None, None, None]","[None, None, None, None]","[0.75, 0.25, None, 0.75]","[None, None, None, None]","[0.75, 0.25, 0.5, 0.75]",[],脖子、尾巴长，头短。
1,62,"[None, None, None, None]","[None, None, None, None]","[None, None, None, None]","[None, None, None, None]","[None, None, None, None]","[None, None, None, None]","[None, None, None, None]","[None, None, None, None]",['四个部位长度相似'],四个部位长度相似。
1,63,"[None, None, None, None]","[None, None, None, None]","[None, None, None, None]","[None, None, None, None]","[None, None, None, None]","[0.75, 0.75, 0.25, 0.25]","[None, None, None, None]","[0.75, 0.75, 0.25, 0.25]",[],头、脖子长，腿、尾巴短。
1,64,"[None, None, None, None]","[None, None, None, None]","[None, None, None, None]","[None, None, None, None]","[None, None, None, None]","[None, None, None, None]","[None, None, None, None]","[None, None, None, None]",['脖子、腿长度相似'],脖子、腿长度相似。
1,65,"[None, None, None, None]","[0.8, 0.8, 0.4, 0.8]","[None, None, None, None]","[None, None, None, None]","[None, None, None, None]","[0.75, 0.75, None, 0.75]","[None, None, None, None]","[0.775, 0.775, 0.4, 0.775]",[],头、脖子、尾巴较长，腿最短。
1,66,"[None, None, None, None]","[None, None, None, None]","[None, None, None, None]","[None, None, None, None]","[None, None, None, None]","[0.75, 0.25, 0.75, 0.75]","[None, None, None, None]","[0.75, 0.25, 0.75, 0.75]",[],脖子、尾巴、腿较长，头较短。
1,67,"[None, None, None, None]","[None, None, None, None]","[None, None, None, None]","[None, None, None, None]","[None, None, None, None]","[0.75, None, None, 0.75]","[None, None, None, None]","[0.75, 0.5, 0.5, 0.75]",[],脖子和尾巴较长。
1,68,"[None, None, None, None]","[None, None, None, None]","[None, None, None, None]","[None, None, None, None]","[None, None, None, None]","[0.75, 0.25, 0.75, 0.75]","[None, None, None, None]","[0.75, 0.25, 0.75, 0.75]",[],脖子、腿、尾巴较长，头较短。
1,69,"[None, None, None, None]","[None, None, None, None]","[None, None, None, None]","[None, None, None, None]","[None, None, None, None]","[None, None, None, None]","[None, None, None, None]","[None, None, None, None]",['脖子和腿差不多长'],脖子和腿差不多长。
1,70,"[None, None, None, None]","[0.8, 0.8, 0.4, 0.8]","[None, None, None, None]","[None, None, None, None]","[None, None, None, None]","[0.75, 0.75, None, 0.75]","[None, None, None, None]","[0.775, 0.775, 0.4, 0.775]",[],腿最短，头、脖子、尾巴较长。
1,71,"[None, None, None, None]","[None, None, None, None]","[None, None, None, None]","[None, None, None, None]","[None, None, None, None]","[0.75, 0.75, 0.75, 0.25]","[None, None, None, None]","[0.75, 0.75, 0.75, 0.25]",[],头、脖子、腿较长，尾巴较短。
1,72,"[None, None, None, None]","[None, None, None, None]","[None, None, None, None]","[None, None, None, None]","[None, None, None, None]","[None, 0.75, None, None]","[None, None, None, None]","[0.5, 0.75, 0.5, 0.5]",[],头较长。
1,73,"[None, None, None, None]","[None, None, None, None]","[None, None, None, None]","[None, None, None, None]","[None, None, None, None]","[None, None, None, None]","[None, None, None, None]","[None, None, None, None]",['头、尾长度相近'],头、尾长度相近。
1,74,"[None, None, None, None]","[None, None, None, None]","[None, None, None, None]","[None, None, None, None]","[None, None, None, None]","[None, None, None, None]","[None, None, None, None]","[None, None, None, None]",['四个部位长度相近'],四个部位长度相近。
1,75,"[None, None, None, None]","[None, None, None, None]","[None, None, None, None]","[None, None, None, None]","[None, None, None, None]","[None, None, None, None]","[None, None, None, None]","[None, None, None, None]",['头、腿长度相近'],头、腿长度相近。
1,76,"[None, None, None, None]","[None, None, None, None]","[None, None, None, None]","[None, None, None, None]","[None, None, None, None]","[0.25, 0.25, 0.25, 0.25]","[None, None, None, None]","[0.25, 0.25, 0.25, 0.25]",[],头、脖子、腿和尾巴都较短。
1,77,"[None, None, None, None]","[None, None, None, None]","[None, None, None, None]","[None, None, None, None]","[None, None, None, None]","[None, 0.25, None, 0.25]","[None, None, None, None]","[0.5, 0.25, 0.5, 0.25]",[],头、尾巴较短。
1,78,"[None, None, None, None]","[None, None, None, None]","[None, None, None, None]","[None, None, None, None]","[None, None, None, None]","[None, None, None, None]","[None, None, None, None]","[None, None, None, None]",['脖子、腿长度相近'],脖子、腿长度相近。
1,79,"[None, None, None, None]","[None, None, None, None]","[None, None, None, None]","[None, None, None, None]","[None, None, None, None]","[0.75, 0.75, None, None]","[None, None, None, None]","[0.75, 0.75, 0.5, 0.5]",[],头、脖子较长。
1,80,"[None, None, None, None]","[None, None, None, None]","[0.75, 0.75, 0.75, 0.75]","[None, None, None, None]","[None, None, None, None]","[None, None, None, None]","[None, None, None, None]","[0.75, 0.75, 0.75, 0.75]",[],四个部位都较长。
1,81,"[None, None, None, None]","[None, None, None, None]","[0.25, 0.25, 0.25, 0.25]","[None, None, None, None]","[None, None, None, None]","[None, None, None, None]","[None, None, None, None]","[0.25, 0.25, 0.25, 0.25]",[],四个部位都较短。
1,82,"[None, None, None, None]","[None, None, None, None]","[None, None, None, None]","[None, None, None, None]","[None, None, None, None]","[None, None, None, None]","[None, None, None, None]","[None, None, None, None]",['脖子和尾巴长度相似'],脖子和尾巴长度相似。
1,83,"[None, None, None, None]","[None, None, None, None]","[None, None, None, None]","[None, None, None, None]","[None, None, None, None]","[None, None, None, None]","[None, None, None, None]","[None, None, None, None]",['脖子和腿长度相似'],脖子和腿长度相似。
1,84,"[None, None, None, None]","[None, None, None, None]","[None, None, None, None]","[None, None, None, None]","[None, None, None, None]","[None, None, None, None]","[None, None, None, None]","[None, None, None, None]",['脖子和尾巴长度相似'],脖子和尾巴长度相似。
1,85,"[None, None, None, None]","[None, None, None, None]","[None, None, None, None]","[None, None, None, None]","[None, None, None, None]","[None, None, None, None]","[None, None, None, None]","[None, None, None, None]",['脖子和尾巴长度相似'],脖子和尾巴长度相似。
1,86,"[None, None, None, None]","[None, None, None, None]","[None, None, None, None]","[None, None, None, None]","[None, None, None, None]","[0.25, None, None, None]","[None, None, None, None]","[0.25, 0.5, 0.5, 0.5]",[],脖子短。
1,87,"[None, None, None, None]","[None, None, None, None]","[None, None, None, None]","[None, None, None, None]","[None, None, None, None]","[None, None, None, None]","[None, None, None, None]","[None, None, None, None]",['脖子和尾巴长度相似'],脖子和尾巴长度相似。
1,88,"[None, None, None, None]","[None, None, None, None]","[0.75, 0.75, 0.75, 0.75]","[None, None, None, None]","[None, None, None, None]","[None, None, None, None]","[None, None, None, None]","[0.75, 0.75, 0.75, 0.75]",[],四个部位都较长。
1,89,"[None, None, None, None]","[None, None, None, None]","[None, None, None, None]","[None, None, None, None]","[None, None, None, None]","[None, None, None, None]","[None, None, None, None]","[None, None, None, None]",['脖子和尾巴长度相似'],脖子和尾巴长度相似。
1,90,"[None, None, None, None]","[None, None, None, None]","[0.25, 0.25, 0.25, 0.25]","[None, None, None, None]","[None, None, None, None]","[None, None, None, None]","[None, None, None, None]","[0.25, 0.25, 0.25, 0.25]",[],四个部位都较短。
1,91,"[None, None, None, None]","[None, None, None, None]","[0.75, 0.75, 0.75, 0.75]","[None, None, None, None]","[None, None, None, None]","[None, None, None, None]","[None, None, None, None]","[0.75, 0.75, 0.75, 0.75]",[],四个部位都较长。
1,92,"[None, None, None, None]","[None, None, None, None]","[None, None, None, None]","[None, None, None, None]","[None, None, None, None]","[None, None, None, None]","[None, None, None, None]","[None, None, None, None]",['脖子和腿长度近似'],脖子和腿长度近似。
1,93,"[None, None, None, None]","[None, None, None, None]","[None, None, None, None]","[None, None, None, None]","[None, None, None, None]","[None, None, None, None]","[None, None, None, None]","[None, None, None, None]",['脖子长度和躯干近似'],脖子长度和躯干近似。
1,94,"[None, None, None, None]","[None, None, None, None]","[None, None, None, None]","[None, None, None, None]","[None, None, None, None]","[None, None, 0.75, None]","[None, None, None, None]","[0.5, 0.5, 0.75, 0.5]",['四个部位长度各不相同'],腿长，四个部位长度各不相同。
1,95,"[None, None, None, None]","[None, None, None, None]","[None, None, None, None]","[None, None, None, None]","[None, None, None, None]","[None, None, None, None]","[None, None, None, None]","[None, None, None, None]",['头和脖子长度近似'],头和脖子长度近似。
1,96,"[None, None, None, None]","[None, None, None, None]","[None, None, None, None]","[None, None, None, None]","[None, None, None, None]","[None, None, None, None]","[None, None, None, None]","[None, None, None, None]",['尾巴和腿长度近似'],尾巴和腿长度近似。
1,97,"[None, None, None, None]","[None, None, None, None]","[None, None, None, None]","[None, None, None, None]","[None, None, None, None]","[None, None, None, None]","[None, None, None, None]","[None, None, None, None]",['四个部位长度各不相同'],四个部位长度各不相同。
1,98,"[None, None, None, None]","[None, None, None, None]","[None, None, None, None]","[None, None, None, None]","[None, None, None, None]","[None, None, None, None]","[None, None, None, None]","[None, None, None, None]",['四个部位长度各不相同'],四个部位长度各不相同。
1,99,"[None, None, None, None]","[None, None, None, None]","[None, None, None, None]","[None, None, None, None]","[None, None, None, None]","[0.75, 0.75, 0.75, 0.25]","[None, None, None, None]","[0.75, 0.75, 0.75, 0.25]",[],头、脖子、腿较长，尾巴稍短。
