exclusion,superlative,universal_quantifier,exclusive_case,comparison,general_case,addition,all,un_pro,origin
"[None, None, None, None]","[None, None, None, None]","[None, None, None, None]","[None, None, None, None]","[None, None, None, None]","[0.25, 0.75, 0.75, 0.25]","[None, None, None, None]","[0.25, 0.75, 0.75, 0.25]",[],头长，腿长，脖子、尾巴短。
"[None, None, None, None]","[None, None, None, None]","[None, None, None, None]","[None, None, None, None]","[None, None, None, None]","[0.25, 0.75, 0.75, 0.25]","[None, None, None, None]","[0.25, 0.75, 0.75, 0.25]",[],头长，腿长，脖子、尾巴较短。
"[None, None, None, None]","[None, None, None, None]","[None, None, None, None]","[None, None, None, None]","[None, None, None, None]","[0.75, 0.25, 0.25, 0.75]","[None, None, None, None]","[0.75, 0.25, 0.25, 0.75]",[],头、腿较短，脖子、尾巴较长。
"[None, None, None, None]","[None, None, None, None]","[None, None, None, None]","[None, None, None, None]","[None, None, None, None]","[0.75, 0.25, 0.25, 0.75]","[None, None, None, None]","[0.75, 0.25, 0.25, 0.75]",[],脖子、尾巴较长，头、腿略短。
"[None, None, None, None]","[None, None, None, None]","[None, None, None, None]","[None, None, None, None]","[None, None, None, None]","[0.25, 0.75, 0.75, 0.25]","[None, None, None, None]","[0.25, 0.75, 0.75, 0.25]",[],头、腿较长，脖子、尾巴较短。
"[None, None, None, None]","[None, None, None, None]","[None, None, None, None]","[None, None, None, None]","[None, None, None, None]","[0.75, 0.25, 0.25, 0.75]","[None, None, None, None]","[0.75, 0.25, 0.25, 0.75]",[],脖子较长，尾巴较长，头、腿略短。
"[None, None, None, None]","[None, None, None, None]","[None, None, None, None]","[None, None, None, None]","[None, None, None, None]","[0.75, 0.25, 0.75, 0.25]","[None, None, None, None]","[0.75, 0.25, 0.75, 0.25]",[],脖子、腿较长，头、尾巴较短。
"[None, None, None, None]","[None, None, None, None]","[None, None, None, None]","[None, None, None, None]","[None, None, None, None]","[0.5, 0.5, 0.25, 0.5]","[None, None, None, None]","[0.5, 0.5, 0.25, 0.5]",[],腿短，头、脖子、尾巴中等长度。
"[None, None, None, None]","[None, None, None, None]","[None, None, None, None]","[None, None, None, None]","[None, None, None, None]","[0.25, 0.25, 0.75, 0.5]","[None, None, None, None]","[0.25, 0.25, 0.75, 0.5]",[],腿长，头、脖子短，尾巴中等长度。
"[None, None, None, None]","[None, None, None, None]","[None, None, None, None]","[None, None, None, None]","[None, None, None, None]","[0.25, 0.75, 0.5, 0.5]","[None, None, None, None]","[0.25, 0.75, 0.5, 0.5]",[],头长，脖子较短，尾巴、腿中等长度。
"[None, None, None, None]","[None, None, None, None]","[None, None, None, None]","[None, None, None, None]","[None, None, None, None]","[0.25, 0.25, 0.75, 0.75]","[None, None, None, None]","[0.25, 0.25, 0.75, 0.75]",[],腿、尾巴长，头、脖子较短。
"[None, None, None, None]","[None, None, None, None]","[None, None, None, None]","[None, None, None, None]","[None, None, None, None]","[0.75, 0.75, 0.25, 0.25]","[None, None, None, None]","[0.75, 0.75, 0.25, 0.25]",[],腿、尾巴短，头、脖子较长。
"[None, None, None, None]","[None, None, None, None]","[None, None, None, None]","[None, None, None, None]","[None, None, None, None]","[0.75, 0.25, 0.25, 0.25]","[None, None, None, None]","[0.75, 0.25, 0.25, 0.25]",[],头、腿、尾巴短，脖子较长。
"[None, None, None, None]","[None, None, None, None]","[None, None, None, None]","[None, None, None, None]","[None, None, None, None]","[0.25, 0.75, 0.75, 0.25]","[None, None, None, None]","[0.25, 0.75, 0.75, 0.25]",[],腿、头长， 脖子、尾巴较短。
"[None, None, None, None]","[None, None, None, None]","[None, None, None, None]","[None, None, None, None]","[None, None, None, None]","[0.5, 0.5, 0.25, 0.5]","[None, None, None, None]","[0.5, 0.5, 0.25, 0.5]",[],腿短，头、脖子、尾巴中等长度。
"[None, None, None, None]","[None, None, None, None]","[None, None, None, None]","[None, None, None, None]","[None, None, None, None]","[0.25, 0.75, 0.25, 0.25]","[None, None, None, None]","[0.25, 0.75, 0.25, 0.25]",[],腿短，头较长，脖子、尾巴较短。
"[None, None, None, None]","[None, None, None, None]","[None, None, None, None]","[None, None, None, None]","[None, None, None, None]","[0.75, 0.5, 0.25, 0.5]","[None, None, None, None]","[0.75, 0.5, 0.25, 0.5]",[],腿短，脖子长，头、尾巴中等长度。
"[None, None, None, None]","[None, None, None, None]","[None, None, None, None]","[None, None, None, None]","[None, None, None, None]","[0.5, 0.25, 0.75, 0.5]","[None, None, None, None]","[0.5, 0.25, 0.75, 0.5]",[],腿长，头短，脖子、尾巴中等长度。
"[None, None, None, None]","[None, None, None, None]","[None, None, None, None]","[None, None, None, None]","[None, None, None, None]","[0.5, 0.5, 0.5, 0.5]","[None, None, None, None]","[0.5, 0.5, 0.5, 0.5]",[],头、脖子、腿、尾巴中等长度。
"[None, None, None, None]","[None, None, None, None]","[None, None, None, None]","[None, None, None, None]","[None, None, None, None]","[0.25, 0.75, 0.75, 0.75]","[None, None, None, None]","[0.25, 0.75, 0.75, 0.75]",[],头、尾巴、腿长，脖子较短。
"[None, None, None, None]","[None, None, None, None]","[None, None, None, None]","[None, None, None, None]","[None, None, None, None]","[0.5, 0.25, 0.5, 0.75]","[None, None, None, None]","[0.5, 0.25, 0.5, 0.75]",[],头短，尾巴长，脖子、腿中等长度。
"[None, None, None, None]","[None, None, None, None]","[None, None, None, None]","[None, None, None, None]","[None, None, None, None]","[0.25, 0.25, 0.25, 0.75]","[None, None, None, None]","[0.25, 0.25, 0.25, 0.75]",[],头、脖子、腿短，尾巴长。
"[None, None, None, None]","[None, None, None, None]","[None, None, None, None]","[None, None, None, None]","[None, None, None, None]","[0.75, 0.75, 0.5, 0.5]","[None, None, None, None]","[0.75, 0.75, 0.5, 0.5]",[],头、脖子长，腿、尾巴中等长度。
"[None, None, None, None]","[None, None, None, None]","[None, None, None, None]","[None, None, None, None]","[None, None, None, None]","[0.75, 0.25, 0.75, 0.25]","[None, None, None, None]","[0.75, 0.25, 0.75, 0.25]",[],脖子、腿长，头、尾巴较短。
"[None, None, None, None]","[None, None, None, None]","[None, None, None, None]","[None, None, None, None]","[None, None, None, None]","[0.25, 0.75, 0.75, 0.25]","[None, None, None, None]","[0.25, 0.75, 0.75, 0.25]",[],头、腿较长，脖子、尾巴较短。
"[None, None, None, None]","[None, None, None, None]","[None, None, None, None]","[None, None, None, None]","[None, None, None, None]","[0.25, 0.25, 0.75, 0.75]","[None, None, None, None]","[0.25, 0.25, 0.75, 0.75]",[],腿、尾巴较长，头、脖子较短。
"[None, None, None, None]","[None, None, None, None]","[None, None, None, None]","[None, None, None, None]","[None, None, None, None]","[0.75, 0.75, 0.25, 0.25]","[None, None, None, None]","[0.75, 0.75, 0.25, 0.25]",[],腿、尾巴短，头、脖子较长。
"[None, None, None, None]","[None, None, None, None]","[None, None, None, None]","[None, None, None, None]","[None, None, None, None]","[0.75, 0.75, 0.25, 0.25]","[None, None, None, None]","[0.75, 0.75, 0.25, 0.25]",[],腿、尾巴短，头、脖子较长。
"[None, None, None, None]","[None, None, None, None]","[None, None, None, None]","[None, None, None, None]","[None, None, None, None]","[0.25, 0.75, 0.75, 0.75]","[None, None, None, None]","[0.25, 0.75, 0.75, 0.75]",[],脖子短，头、腿、尾巴较长。
"[None, None, None, None]","[None, None, None, None]","[None, None, None, None]","[None, None, None, None]","[None, None, None, None]","[0.5, 0.5, 0.25, 0.5]","[None, None, None, None]","[0.5, 0.5, 0.25, 0.5]",[],腿短，头、脖子、尾巴中等长度。
"[None, None, None, None]","[None, None, None, None]","[None, None, None, None]","[None, None, None, None]","[None, None, None, None]","[0.5, 0.75, 0.25, 0.5]","[None, None, None, None]","[0.5, 0.75, 0.25, 0.5]",[],腿较短，头较长，脖子、尾巴中等长度。
"[None, None, None, None]","[None, None, None, None]","[None, None, None, None]","[None, None, None, None]","[None, None, None, None]","[0.75, 0.75, 0.5, 0.5]","[None, None, None, None]","[0.75, 0.75, 0.5, 0.5]",[],头、脖子长，腿、尾巴中等长度。
"[None, None, None, None]","[None, None, None, None]","[None, None, None, None]","[None, None, None, None]","[None, None, None, None]","[0.75, 0.75, 0.75, 0.25]","[None, None, None, None]","[0.75, 0.75, 0.75, 0.25]",[],尾巴短，头、脖子、腿长。
"[None, None, None, None]","[None, None, None, None]","[None, None, None, None]","[None, None, None, None]","[None, None, None, None]","[0.5, 0.5, 0.5, 0.5]","[None, None, None, None]","[0.5, 0.5, 0.5, 0.5]",[],头、脖子、腿、尾巴中等长度。
"[None, None, None, None]","[None, None, None, None]","[None, None, None, None]","[None, None, None, None]","[None, None, None, None]","[0.25, 0.5, 0.75, 0.75]","[None, None, None, None]","[0.25, 0.5, 0.75, 0.75]",[],脖子短，尾巴、腿长，头中等长度。
"[None, None, None, None]","[None, None, None, None]","[None, None, None, None]","[None, None, None, None]","[None, None, None, None]","[0.5, 0.5, 0.5, 0.5]","[None, None, None, None]","[0.5, 0.5, 0.5, 0.5]",[],头、脖子、腿、尾巴中等长度。
"[None, None, None, None]","[None, None, None, None]","[None, None, None, None]","[None, None, None, None]","[None, None, None, None]","[0.25, 0.75, 0.75, 0.75]","[None, None, None, None]","[0.25, 0.75, 0.75, 0.75]",[],脖子短，头、腿、尾巴长。
"[None, None, None, None]","[None, None, None, None]","[None, None, None, None]","[None, None, None, None]","[None, None, None, None]","[0.5, 0.5, 0.5, 0.5]","[None, None, None, None]","[0.5, 0.5, 0.5, 0.5]",[],头、脖子、腿、尾巴中等长度。
"[None, None, None, None]","[None, None, None, None]","[None, None, None, None]","[None, None, None, None]","[None, None, None, None]","[0.75, 0.75, 0.75, 0.25]","[None, None, None, None]","[0.75, 0.75, 0.75, 0.25]",[],头、脖子长，腿长，尾巴短。
"[None, None, None, None]","[None, None, None, None]","[None, None, None, None]","[None, None, None, None]","[None, None, None, None]","[0.75, 0.75, 0.75, 0.25]","[None, None, None, None]","[0.75, 0.75, 0.75, 0.25]",[],头、脖子长，腿长，尾巴短。
"[None, None, None, None]","[None, None, None, None]","[None, None, None, None]","[None, None, None, None]","[None, None, None, None]","[0.75, 0.75, 0.75, 0.25]","[None, None, None, None]","[0.75, 0.75, 0.75, 0.25]",[],头、脖子长，腿长，尾巴短。
"[None, None, None, None]","[None, None, None, None]","[None, None, None, None]","[None, None, None, None]","[None, None, None, None]","[0.5, 0.75, 0.75, 0.75]","[None, None, None, None]","[0.5, 0.75, 0.75, 0.75]",[],尾巴长，腿较长，头较长，脖子中等长度。
"[None, None, None, None]","[None, None, None, None]","[None, None, None, None]","[None, None, None, None]","[None, None, None, None]","[0.75, 0.25, 0.25, 0.75]","[None, None, None, None]","[0.75, 0.25, 0.25, 0.75]",[],头、腿短，脖子、尾巴较长。
"[None, None, None, None]","[None, None, None, None]","[None, None, None, None]","[None, None, None, None]","[None, None, None, None]","[0.75, 0.25, 0.5, 0.5]","[None, None, None, None]","[0.75, 0.25, 0.5, 0.5]",[],脖子长，头短，腿、尾巴中等长度。
"[None, None, None, None]","[None, None, None, None]","[None, None, None, None]","[None, None, None, None]","[None, None, None, None]","[0.75, 0.75, 0.25, 0.75]","[None, None, None, None]","[0.75, 0.75, 0.25, 0.75]",[],头、脖子、尾巴长，腿较短。
"[None, None, None, None]","[None, None, None, None]","[None, None, None, None]","[None, None, None, None]","[None, None, None, None]","[0.75, 0.75, 0.25, 0.75]","[None, None, None, None]","[0.75, 0.75, 0.25, 0.75]",[],头、脖子、尾巴长，腿较短。
"[None, None, None, None]","[None, None, None, None]","[None, None, None, None]","[None, None, None, None]","[None, None, None, None]","[0.75, 0.75, 0.25, 0.75]","[None, None, None, None]","[0.75, 0.75, 0.25, 0.75]",[],头、脖子、尾巴长，腿较短。
"[None, None, None, None]","[None, None, None, None]","[None, None, None, None]","[None, None, None, None]","[None, None, None, None]","[0.625, 0.5, 0.5, 0.625]","[None, None, None, None]","[0.625, 0.5, 0.5, 0.625]",[],头、脖子、尾巴、腿中等长度，尾巴、脖子略长。
"[None, None, None, None]","[None, None, None, None]","[None, None, None, None]","[None, None, None, None]","[None, None, None, None]","[0.25, 0.5, 0.5, 0.5]","[None, None, None, None]","[0.25, 0.5, 0.5, 0.5]",[],脖子短，头、腿、尾巴中等长度。
"[None, None, None, None]","[None, None, None, None]","[None, None, None, None]","[None, None, None, None]","[None, None, None, None]","[0.75, 0.5, 0.5, 0.75]","[None, None, None, None]","[0.75, 0.5, 0.5, 0.75]",[],脖子、尾巴长，头、腿中等长度。
"[None, None, None, None]","[None, None, None, None]","[None, None, None, None]","[None, None, None, None]","[None, None, None, None]","[0.75, 0.75, 0.5, 0.5]","[None, None, None, None]","[0.75, 0.75, 0.5, 0.5]",[],头、脖子长，腿、尾巴中等长度。
"[None, None, None, None]","[None, None, None, None]","[None, None, None, None]","[None, None, None, None]","[None, None, None, None]","[0.5, 0.5, 0.75, 0.25]","[None, None, None, None]","[0.5, 0.5, 0.75, 0.25]",[],尾巴短，腿长，头、脖子中等长度。
"[None, None, None, None]","[None, None, None, None]","[None, None, None, None]","[None, None, None, None]","[None, None, None, None]","[0.75, 0.25, 0.25, 0.25]","[None, None, None, None]","[0.75, 0.25, 0.25, 0.25]",[],脖子长，头、腿、尾巴较短。
"[None, None, None, None]","[None, None, None, None]","[None, None, None, None]","[None, None, None, None]","[None, None, None, None]","[0.25, 0.25, 0.25, 0.75]","[None, None, None, None]","[0.25, 0.25, 0.25, 0.75]",[],尾巴长，脖子、头、腿较短。
"[None, None, None, None]","[None, None, None, None]","[None, None, None, None]","[None, None, None, None]","[None, None, None, None]","[0.5, 0.25, 0.5, 0.75]","[None, None, None, None]","[0.5, 0.25, 0.5, 0.75]",[],尾巴长，头短，脖子、腿中等长度。
"[None, None, None, None]","[None, None, None, None]","[None, None, None, None]","[None, None, None, None]","[None, None, None, None]","[0.5, 0.25, 0.5, 0.75]","[None, None, None, None]","[0.5, 0.25, 0.5, 0.75]",[],头短，尾巴长，脖子、腿中等长度。
"[None, None, None, None]","[None, None, None, None]","[None, None, None, None]","[None, None, None, None]","[None, None, None, None]","[0.5, 0.5, 0.25, 0.5]","[None, None, None, None]","[0.5, 0.5, 0.25, 0.5]",[],腿短，头、脖子、尾巴中等长度。
"[None, None, None, None]","[None, None, None, None]","[None, None, None, None]","[None, None, None, None]","[None, None, None, None]","[0.5, 0.5, 0.5, 0.5]","[None, None, None, None]","[0.5, 0.5, 0.5, 0.5]",[],头、脖子、腿、尾巴中等长度。
"[None, None, None, None]","[None, None, None, None]","[None, None, None, None]","[None, None, None, None]","[None, None, None, None]","[0.5, 0.25, 0.75, 0.25]","[None, None, None, None]","[0.5, 0.25, 0.75, 0.25]",[],头、尾巴短，腿长，脖子中等长度。
"[None, None, None, None]","[None, None, None, None]","[None, None, None, None]","[None, None, None, None]","[None, None, None, None]","[0.5, 0.5, 0.5, 0.25]","[None, None, None, None]","[0.5, 0.5, 0.5, 0.25]",[],尾巴短，腿、脖子、头中等长度。
"[None, None, None, None]","[None, None, None, None]","[None, None, None, None]","[None, None, None, None]","[None, None, None, None]","[0.75, 0.25, 0.25, 0.75]","[None, None, None, None]","[0.75, 0.25, 0.25, 0.75]",[],尾巴、脖子长，头、腿短。
"[None, None, None, None]","[None, None, None, None]","[None, None, None, None]","[None, None, None, None]","[None, None, None, None]","[0.75, 0.25, 0.25, 0.75]","[None, None, None, None]","[0.75, 0.25, 0.25, 0.75]",[],尾巴、脖子长，头、腿短。
"[None, None, None, None]","[None, None, None, None]","[None, None, None, None]","[None, None, None, None]","[None, None, None, None]","[0.5, 0.5, 0.5, 0.5]","[None, None, None, None]","[0.5, 0.5, 0.5, 0.5]",[],尾巴、脖子、头、腿中等长度。
"[None, None, None, None]","[None, None, None, None]","[None, None, None, None]","[None, None, None, None]","[None, None, None, None]","[0.25, 0.5, 0.5, 0.5]","[None, None, None, None]","[0.25, 0.5, 0.5, 0.5]",[],脖子短，头、腿、尾巴中等长度。
"[None, None, None, None]","[None, None, None, None]","[None, None, None, None]","[None, None, None, None]","[None, None, None, None]","[None, 0.75, None, None]","[None, None, None, None]","[0.5, 0.75, 0.5, 0.5]",['脖子、尾巴、腿长等长度'],头长，脖子、尾巴、腿长等长度。
"[None, None, None, None]","[None, None, None, None]","[None, None, None, None]","[None, None, None, None]","[None, None, None, None]","[0.5, 0.25, 0.5, 0.5]","[None, None, None, None]","[0.5, 0.25, 0.5, 0.5]",[],头短，脖子、尾巴、腿中等长度。
"[None, None, None, None]","[None, None, None, None]","[None, None, None, None]","[None, None, None, None]","[None, None, None, None]","[0.5, 0.5, 0.25, 0.5]","[None, None, None, None]","[0.5, 0.5, 0.25, 0.5]",[],腿短，头、脖子、尾巴中等长度。
"[None, None, None, None]","[None, None, None, None]","[None, None, None, None]","[None, None, None, None]","[None, None, None, None]","[0.25, 0.5, 0.5, 0.75]","[None, None, None, None]","[0.25, 0.5, 0.5, 0.75]",[],尾巴长，脖子短，头、腿中等长度。
"[None, None, None, None]","[None, None, None, None]","[None, None, None, None]","[None, None, None, None]","[None, None, None, None]","[0.25, 0.75, 0.75, 0.25]","[None, None, None, None]","[0.25, 0.75, 0.75, 0.25]",[],脖子、尾巴较短，头、腿较长。
"[None, None, None, None]","[None, None, None, None]","[None, None, None, None]","[None, None, None, None]","[None, None, None, None]","[0.75, 0.5, 0.5, 0.5]","[None, None, None, None]","[0.75, 0.5, 0.5, 0.5]",[],脖子长，头、尾巴、腿中等长度。
"[None, None, None, None]","[None, None, None, None]","[None, None, None, None]","[None, None, None, None]","[None, None, None, None]","[0.75, 0.75, 0.25, 0.5]","[None, None, None, None]","[0.75, 0.75, 0.25, 0.5]",[],头、脖子长，腿短，尾巴中等长度。
"[None, None, None, None]","[None, None, None, None]","[None, None, None, None]","[None, None, None, None]","[None, None, None, None]","[0.5, 0.5, 0.25, 0.75]","[None, None, None, None]","[0.5, 0.5, 0.25, 0.75]",[],尾巴长，腿短，头、脖子中等长度。
"[None, None, None, None]","[None, None, None, None]","[None, None, None, None]","[None, None, None, None]","[None, None, None, None]","[0.5, 0.5, 0.75, 0.5]","[None, None, None, None]","[0.5, 0.5, 0.75, 0.5]",[],腿长，头、脖子、尾巴中等长度。
"[None, None, None, None]","[None, None, None, None]","[None, None, None, None]","[None, None, None, None]","[None, None, None, None]","[0.5, 0.75, 0.25, 0.5]","[None, None, None, None]","[0.5, 0.75, 0.25, 0.5]",[],头长，腿短，脖子、尾巴中等长度。
"[None, None, None, None]","[None, None, None, None]","[None, None, None, None]","[None, None, None, None]","[None, None, None, None]","[0.25, 0.75, 0.75, 0.75]","[None, None, None, None]","[0.25, 0.75, 0.75, 0.75]",[],头、尾巴、腿长，脖子短。
"[None, None, None, None]","[None, None, None, None]","[None, None, None, None]","[None, None, None, None]","[None, None, None, None]","[None, None, None, None]","[None, None, None, None]","[None, None, None, None]",['头、脖子、腿、尾巴等长度'],头、脖子、腿、尾巴等长度。
"[None, None, None, None]","[None, None, None, None]","[None, None, None, None]","[None, None, None, None]","[None, None, None, None]","[0.5, 0.5, 0.75, 0.5]","[None, None, None, None]","[0.5, 0.5, 0.75, 0.5]",[],腿长，头、脖子、尾巴中等长度。
"[None, None, None, None]","[None, None, None, None]","[None, None, None, None]","[None, None, None, None]","[None, None, None, None]","[0.75, 0.5, 0.5, 0.5]","[None, None, None, None]","[0.75, 0.5, 0.5, 0.5]",[],脖子长，头、腿、尾巴中等长度。
"[None, None, None, None]","[None, None, None, None]","[None, None, None, None]","[None, None, None, None]","[None, None, None, None]","[0.25, 0.75, 0.25, 0.75]","[None, None, None, None]","[0.25, 0.75, 0.25, 0.75]",[],尾巴长，腿短，脖子较短，头较长。
"[None, None, None, None]","[None, None, None, None]","[None, None, None, None]","[None, None, None, None]","[None, None, None, None]","[0.5, 0.75, 0.25, 0.5]","[None, None, None, None]","[0.5, 0.75, 0.25, 0.5]",[],头长，腿短，脖子、尾巴中等长度。
"[None, None, None, None]","[None, None, None, None]","[None, None, None, None]","[None, None, None, None]","[None, None, None, None]","[0.75, 0.5, 0.75, 0.75]","[None, None, None, None]","[0.75, 0.5, 0.75, 0.75]",[],脖子、腿、尾巴长，头中等长度。
"[None, None, None, None]","[None, None, None, None]","[None, None, None, None]","[None, None, None, None]","[None, None, None, None]","[0.5, 0.75, 0.5, 0.5]","[None, None, None, None]","[0.5, 0.75, 0.5, 0.5]",[],头长，脖子、尾巴、腿中等长度。
"[None, None, None, None]","[None, None, None, None]","[None, None, None, None]","[None, None, None, None]","[None, None, None, None]","[0.5, 0.5, 0.5, 0.75]","[None, None, None, None]","[0.5, 0.5, 0.5, 0.75]",[],尾巴长，头、脖子、腿中等长度。
"[None, None, None, None]","[None, None, None, None]","[None, None, None, None]","[None, None, None, None]","[None, None, None, None]","[0.25, 0.75, 0.25, 0.75]","[None, None, None, None]","[0.25, 0.75, 0.25, 0.75]",[],脖子、腿较短，头、尾巴较长。
"[None, None, None, None]","[None, None, None, None]","[None, None, None, None]","[None, None, None, None]","[None, None, None, None]","[0.25, 0.75, 0.75, 0.75]","[None, None, None, None]","[0.25, 0.75, 0.75, 0.75]",[],腿、尾巴长，脖子短，头较长。
"[None, None, None, None]","[None, None, None, None]","[None, None, None, None]","[None, None, None, None]","[None, None, None, None]","[0.75, 0.5, 0.5, 0.75]","[None, None, None, None]","[0.75, 0.5, 0.5, 0.75]",[],脖子、尾巴长，头、腿中等长度。
"[None, None, None, None]","[None, None, None, None]","[None, None, None, None]","[None, None, None, None]","[None, None, None, None]","[0.5, 0.5, 0.25, 0.75]","[None, None, None, None]","[0.5, 0.5, 0.25, 0.75]",[],腿短，尾巴长，脖子、头中等长度。
"[None, None, None, None]","[None, None, None, None]","[None, None, None, None]","[None, None, None, None]","[None, None, None, None]","[0.5, 0.5, 0.75, 0.5]","[None, None, None, None]","[0.5, 0.5, 0.75, 0.5]",[],腿长，头、脖子、尾巴中等长度。
"[None, None, None, None]","[None, None, None, None]","[None, None, None, None]","[None, None, None, None]","[None, None, None, None]","[0.5, 0.5, 0.75, 0.25]","[None, None, None, None]","[0.5, 0.5, 0.75, 0.25]",[],尾巴短，腿长，头、脖子中等长度。
"[None, None, None, None]","[None, None, None, None]","[None, None, None, None]","[None, None, None, None]","[None, None, None, None]","[0.25, 0.75, 0.75, 0.75]","[None, None, None, None]","[0.25, 0.75, 0.75, 0.75]",[],头、尾巴、腿较长，脖子较短。
"[None, None, None, None]","[None, None, None, None]","[None, None, None, None]","[None, None, None, None]","[None, None, None, None]","[0.75, 0.75, 0.5, 0.5]","[None, None, None, None]","[0.75, 0.75, 0.5, 0.5]",[],头、脖子长，腿、尾巴中等长度。
"[None, None, None, None]","[None, None, None, None]","[None, None, None, None]","[None, None, None, None]","[None, None, None, None]","[0.5, 0.5, 0.5, 0.5]","[None, None, None, None]","[0.5, 0.5, 0.5, 0.5]",[],头、脖子、腿、尾巴中等长度。
"[None, None, None, None]","[None, None, None, None]","[None, None, None, None]","[None, None, None, None]","[None, None, None, None]","[0.75, 0.5, 0.5, 0.25]","[None, None, None, None]","[0.75, 0.5, 0.5, 0.25]",[],尾巴短，脖子长，头、腿中等长度。
"[None, None, None, None]","[None, None, None, None]","[None, None, None, None]","[None, None, None, None]","[None, None, None, None]","[0.5, 0.5, 0.5, 0.5]","[None, None, None, None]","[0.5, 0.5, 0.5, 0.5]",[],头、脖子、腿、尾巴中等长度。
"[None, None, None, None]","[None, None, None, None]","[None, None, None, None]","[None, None, None, None]","[None, None, None, None]","[0.75, None, None, None]","[None, None, None, None]","[0.75, 0.5, 0.5, 0.5]",['头、腿、尾巴等长度'],脖子长，头、腿、尾巴等长度。
"[None, None, None, None]","[None, None, None, None]","[None, None, None, None]","[None, None, None, None]","[None, None, None, None]","[0.5, 0.5, 0.5, 0.5]","[None, None, None, None]","[0.5, 0.5, 0.5, 0.5]",[],头、脖子、腿、尾巴中等长度。
"[None, None, None, None]","[None, None, None, None]","[None, None, None, None]","[None, None, None, None]","[None, None, None, None]","[0.5, 0.25, 0.5, 0.75]","[None, None, None, None]","[0.5, 0.25, 0.5, 0.75]",[],头短，尾巴长，腿、脖子中等长度。
"[None, None, None, None]","[None, None, None, None]","[None, None, None, None]","[None, None, None, None]","[None, None, None, None]","[0.5, 0.5, 0.75, 0.5]","[None, None, None, None]","[0.5, 0.5, 0.75, 0.5]",[],腿长，头、脖子、尾巴中等长度。
