iSession,iTrial,exclusion,superlative,universal_quantifier,exclusive_case,comparison,general_case,addition,all,un_pro,text
1,100,"[None, None, None, None]","[None, None, None, None]","[None, None, None, None]","[None, None, None, None]","[None, None, None, None]","[None, None, None, None]","[None, None, None, None]","[None, None, None, None]",['四个部位长度各不相同'],四个部位长度各不相同。
1,101,"[None, None, None, None]","[None, None, None, None]","[None, None, None, None]","[None, None, None, None]","[None, None, None, None]","[None, None, None, None]","[None, None, None, None]","[None, None, None, None]",['四个部位长度各不相同'],四个部位长度各不相同。
1,102,"[None, None, None, None]","[None, None, None, None]","[None, None, None, None]","[None, None, None, None]","[None, None, None, None]","[0.75, 0.75, 0.25, None]","[None, None, None, None]","[0.75, 0.75, 0.25, 0.5]",[],腿短，头、脖子和尾长。
1,103,"[None, None, None, None]","[None, None, None, None]","[None, None, None, None]","[None, None, None, None]","[None, None, None, None]","[None, None, None, None]","[None, None, None, None]","[None, None, None, None]",['四个部位长度各不相同'],四个部位长度各不相同。
1,104,"[None, None, None, None]","[None, None, None, None]","[None, None, None, None]","[None, None, None, None]","[0.3333333333333333, 0.6666666666666666, None, None]","[None, None, None, None]","[None, None, None, None]","[0.3333333333333333, 0.6666666666666666, 0.5, 0.5]",[],头比脖子长。
1,105,"[None, None, None, None]","[None, None, None, None]","[None, None, None, None]","[None, None, None, None]","[0.3333333333333333, 0.6666666666666666, None, None]","[None, None, None, None]","[None, None, None, None]","[0.3333333333333333, 0.6666666666666666, 0.5, 0.5]",[],头比脖子长。
1,106,"[None, None, None, None]","[None, None, None, None]","[None, None, None, None]","[None, None, None, None]","[None, None, None, None]","[0.75, 0.75, 0.75, 0.75]","[None, None, None, None]","[0.75, 0.75, 0.75, 0.75]",[],头、脖子、腿和尾巴都较长。
1,107,"[None, None, None, None]","[None, None, None, None]","[None, None, None, None]","[None, None, None, None]","[None, None, None, None]","[None, None, None, None]","[None, None, None, None]","[None, None, None, None]",['有两个部位的长度超过了躯干'],有两个部位的长度超过了躯干。
1,108,"[None, None, None, None]","[None, None, None, None]","[None, None, None, None]","[None, None, None, None]","[None, None, None, None]","[None, None, 0.75, None]","[None, None, None, None]","[0.5, 0.5, 0.75, 0.5]",[],腿较长。
1,109,"[None, None, None, None]","[None, None, None, None]","[None, None, None, None]","[None, None, None, None]","[None, None, None, None]","[None, 0.75, 0.75, None]","[None, None, None, None]","[0.5, 0.75, 0.75, 0.5]",[],头和腿较长。
1,110,"[None, None, None, None]","[None, None, None, None]","[None, None, None, None]","[None, None, None, None]","[None, None, None, None]","[None, 0.75, 0.25, None]","[None, None, None, None]","[0.5, 0.75, 0.25, 0.5]",[],头、尾较长，腿较短。
1,111,"[None, None, None, None]","[None, None, None, None]","[None, None, None, None]","[None, None, None, None]","[None, None, None, None]","[None, None, None, 0.25]","[None, None, None, None]","[0.5, 0.5, 0.5, 0.25]",[],尾巴短。
1,112,"[None, None, None, None]","[None, None, None, None]","[None, None, None, None]","[None, None, None, None]","[None, None, None, None]","[0.25, 0.75, 0.75, 0.75]","[None, None, None, None]","[0.25, 0.75, 0.75, 0.75]",[],头、腿尾巴较长，脖子短。
1,113,"[None, None, None, None]","[None, None, None, None]","[None, None, None, None]","[None, None, None, None]","[None, None, None, None]","[None, None, None, None]","[None, None, None, None]","[None, None, None, None]",['头和脖子一样长'],头和脖子一样长。
1,114,"[None, None, None, None]","[None, None, None, None]","[None, None, None, None]","[None, None, None, None]","[None, None, None, None]","[None, None, None, None]","[None, None, None, None]","[None, None, None, None]",['四个部位长度不同'],四个部位长度不同。
1,115,"[None, None, None, None]","[None, None, None, None]","[None, None, None, None]","[None, None, None, None]","[None, None, None, None]","[None, None, None, None]","[None, None, None, None]","[None, None, None, None]",['四个部位长度不同'],四个部位长度不同。
1,116,"[None, None, None, None]","[None, None, None, None]","[None, None, None, None]","[None, None, None, None]","[None, None, None, None]","[None, None, None, None]","[None, None, None, None]","[None, None, None, None]",['头和尾巴一样长'],头和尾巴一样长。
1,117,"[None, None, None, None]","[None, None, None, None]","[None, None, None, None]","[None, None, None, None]","[None, None, None, None]","[None, None, None, None]","[None, None, None, None]","[None, None, None, None]",['头和脖子一样长'],头和脖子一样长。
1,118,"[None, None, None, None]","[None, None, None, None]","[None, None, None, None]","[None, None, None, None]","[None, None, None, None]","[None, None, None, None]","[None, None, None, None]","[None, None, None, None]",['脖子和尾巴一样长'],脖子和尾巴一样长。
1,119,"[None, None, None, None]","[None, None, None, None]","[None, None, None, None]","[None, None, None, None]","[None, None, None, None]","[None, None, None, None]","[None, None, None, None]","[None, None, None, None]",['脖子和腿一样长'],脖子和腿一样长。
1,120,"[None, None, None, None]","[None, None, None, None]","[None, None, None, None]","[None, None, None, None]","[None, None, None, None]","[None, None, None, None]","[None, None, None, None]","[None, None, None, None]",['头和尾巴差不多长'],头和尾巴差不多长。
1,121,"[None, None, None, None]","[None, None, None, None]","[None, None, None, None]","[None, None, None, None]","[None, None, None, None]","[None, None, None, 0.25]","[None, None, None, None]","[0.5, 0.5, 0.5, 0.25]",['头、脖子和腿差不多长'],头、脖子和腿差不多长，尾巴短。
1,122,"[None, None, None, None]","[None, None, None, None]","[None, None, None, None]","[None, None, None, None]","[None, None, None, None]","[None, None, None, None]","[None, None, None, None]","[None, None, None, None]",['头和尾巴差不多长'],头和尾巴差不多长。
1,123,"[None, None, None, None]","[None, None, None, None]","[None, None, None, None]","[None, None, None, None]","[None, None, None, None]","[None, 0.75, 0.75, None]","[None, None, None, None]","[0.5, 0.75, 0.75, 0.5]",[],头和腿比较长。
1,124,"[None, None, None, None]","[None, None, None, None]","[None, None, None, None]","[None, None, None, None]","[None, None, None, None]","[0.75, 0.75, 0.25, 0.75]","[None, None, None, None]","[0.75, 0.75, 0.25, 0.75]",[],头、脖子、尾巴较长，腿较短。
1,125,"[None, None, None, None]","[None, None, None, None]","[0.25, 0.25, 0.25, 0.25]","[None, None, None, None]","[None, None, None, None]","[None, None, None, None]","[None, None, None, None]","[0.25, 0.25, 0.25, 0.25]",[],四个部位都较短。
1,126,"[None, None, None, None]","[None, None, None, None]","[0.25, 0.25, 0.25, 0.25]","[None, None, None, None]","[None, None, None, None]","[None, None, None, None]","[None, None, None, None]","[0.25, 0.25, 0.25, 0.25]",[],四个部位都较短。
1,127,"[None, None, None, None]","[None, None, None, None]","[None, None, None, None]","[None, None, None, None]","[None, None, None, None]","[0.75, None, None, None]","[None, None, None, None]","[0.75, 0.5, 0.5, 0.5]",[],脖子较长。
1,128,"[None, None, None, None]","[None, None, None, None]","[None, None, None, None]","[None, None, None, None]","[None, None, None, None]","[0.75, 0.75, None, None]","[None, None, None, None]","[0.75, 0.75, 0.5, 0.5]",[],头和脖子较长。
1,129,"[None, None, None, None]","[None, None, None, None]","[None, None, None, None]","[None, None, None, None]","[None, None, None, None]","[0.75, None, 0.75, None]","[None, None, None, None]","[0.75, 0.5, 0.75, 0.5]",[],脖子和腿较长。
1,130,"[None, None, None, None]","[None, None, None, None]","[None, None, None, None]","[None, None, None, None]","[None, None, None, None]","[0.75, 0.25, 0.75, 0.75]","[None, None, None, None]","[0.75, 0.25, 0.75, 0.75]",[],脖子、尾巴和腿较长，头较短。
1,131,"[None, None, None, None]","[None, None, None, None]","[None, None, None, None]","[None, None, None, None]","[None, None, None, None]","[None, None, None, None]","[None, None, None, None]","[None, None, None, None]",['脖子和尾巴一样长'],脖子和尾巴一样长。
1,132,"[None, None, None, None]","[None, None, None, None]","[None, None, None, None]","[None, None, None, None]","[None, None, None, None]","[None, None, None, None]","[None, None, None, None]","[None, None, None, None]",['四个部位长度各不相同'],四个部位长度各不相同。
1,133,"[None, None, None, None]","[None, None, None, None]","[None, None, None, None]","[None, None, None, None]","[None, None, None, None]","[None, None, None, None]","[None, None, None, None]","[None, None, None, None]",['四个部位长度各不相同'],四个部位长度各不相同。
1,134,"[None, None, None, None]","[None, None, None, None]","[None, None, None, None]","[None, None, None, None]","[None, None, None, None]","[None, None, None, None]","[None, None, None, None]","[None, None, None, None]",['头、尾巴长度相似'],头、尾巴长度相似。
1,135,"[None, None, None, None]","[None, None, None, None]","[None, None, None, None]","[None, None, None, None]","[None, 0.6666666666666666, None, 0.3333333333333333]","[None, None, 0.25, None]","[None, None, None, None]","[0.5, 0.6666666666666666, 0.25, 0.3333333333333333]",[],腿较短，头比尾巴长。
1,136,"[None, None, None, None]","[None, None, None, None]","[0.25, 0.25, 0.25, 0.25]","[None, None, None, None]","[None, None, None, None]","[None, None, None, None]","[None, None, None, None]","[0.25, 0.25, 0.25, 0.25]",[],四个部位都较短。
1,137,"[None, None, None, None]","[None, None, None, None]","[None, None, None, None]","[None, None, None, None]","[None, None, None, None]","[None, None, None, None]","[None, None, None, None]","[None, None, None, None]",['头和尾巴一样长'],头和尾巴一样长。
1,138,"[None, None, None, None]","[None, None, None, None]","[None, None, None, None]","[None, None, None, None]","[None, None, None, None]","[None, None, None, None]","[None, None, None, None]","[None, None, None, None]",['头和尾巴一样长'],头和尾巴一样长。
1,139,"[None, None, None, None]","[None, None, None, None]","[0.25, 0.25, 0.25, 0.25]","[None, None, None, None]","[None, None, None, None]","[None, None, None, None]","[None, None, None, None]","[0.25, 0.25, 0.25, 0.25]",[],四个部位都较短。
1,140,"[None, None, None, None]","[None, None, None, None]","[0.25, 0.25, 0.25, 0.25]","[None, None, None, None]","[None, None, None, None]","[None, None, None, None]","[None, None, None, None]","[0.25, 0.25, 0.25, 0.25]",[],四个部位都较短。
1,141,"[None, None, None, None]","[None, None, None, None]","[0.75, 0.75, 0.75, 0.75]","[None, None, None, None]","[None, None, None, None]","[None, None, None, None]","[None, None, None, None]","[0.75, 0.75, 0.75, 0.75]",[],四个部位都较长。
1,142,"[None, None, None, None]","[0.4, 0.8, 0.4, 0.4]","[None, None, None, None]","[None, None, None, None]","[None, None, None, None]","[None, None, None, None]","[None, None, None, None]","[0.4, 0.8, 0.4, 0.4]",['脖子和腿长度相近'],脖子和腿长度相近，头最长。
1,143,"[None, None, None, None]","[None, None, None, None]","[None, None, None, None]","[None, None, None, None]","[None, None, None, None]","[None, None, 0.25, None]","[None, None, None, None]","[0.5, 0.5, 0.25, 0.5]",['头、脖子、尾长度相近'],头、脖子、尾长度相近，腿短。
1,144,"[None, None, None, None]","[None, None, None, None]","[None, None, None, None]","[None, None, None, None]","[None, None, None, None]","[None, None, None, None]","[None, None, None, None]","[None, None, None, None]",['脖子、尾巴一样长'],脖子、尾巴一样长。
1,145,"[None, None, None, None]","[None, None, None, None]","[None, None, None, None]","[None, None, None, None]","[None, None, None, None]","[None, None, None, None]","[None, None, None, None]","[None, None, None, None]",['头、尾差不多长'],头、尾差不多长。
1,146,"[None, None, None, None]","[None, None, None, None]","[None, None, None, None]","[None, None, None, None]","[None, None, None, None]","[None, None, None, None]","[None, None, None, None]","[None, None, None, None]",['头、尾巴差不多长'],头、尾巴差不多长。
1,147,"[None, None, None, None]","[None, None, None, None]","[0.75, 0.75, 0.75, 0.75]","[None, None, None, None]","[None, None, None, None]","[None, None, None, None]","[None, None, None, None]","[0.75, 0.75, 0.75, 0.75]",[],四个部位都较长。
1,148,"[None, None, None, None]","[None, None, None, None]","[None, None, None, None]","[None, None, None, None]","[None, None, None, None]","[None, None, None, None]","[None, None, None, None]","[None, None, None, None]",['四个部位长度不一'],四个部位长度不一。
1,149,"[None, None, None, None]","[None, None, None, None]","[None, None, None, None]","[None, None, None, None]","[None, None, None, None]","[None, None, None, None]","[None, None, None, None]","[None, None, None, None]",['头、尾巴一样长'],头、尾巴一样长。
1,150,"[None, None, None, None]","[None, None, None, None]","[None, None, None, None]","[None, None, None, None]","[0.3333333333333333, 0.6666666666666666, None, None]","[None, None, None, None]","[None, None, None, None]","[0.3333333333333333, 0.6666666666666666, 0.5, 0.5]",[],头比脖子长。
1,151,"[None, None, None, None]","[None, None, None, None]","[None, None, None, None]","[None, None, None, None]","[None, None, None, None]","[None, 0.25, None, None]","[None, None, None, None]","[0.5, 0.25, 0.5, 0.5]",[],头较短。
1,152,"[None, None, None, None]","[None, None, None, None]","[0.25, 0.25, 0.25, 0.25]","[None, None, None, None]","[None, None, None, None]","[None, None, None, None]","[None, None, None, None]","[0.25, 0.25, 0.25, 0.25]",[],这四个部位都较短。
1,153,"[None, None, None, None]","[None, None, None, None]","[None, None, None, None]","[None, None, None, None]","[None, None, None, None]","[None, None, None, None]","[None, None, None, None]","[None, None, None, None]",['头和尾巴差不多长'],头和尾巴差不多长。
1,154,"[None, None, None, None]","[None, None, None, None]","[None, None, None, None]","[None, None, None, None]","[None, None, None, None]","[None, None, None, None]","[None, None, None, None]","[None, None, None, None]",['脖子和尾巴差不多长'],脖子和尾巴差不多长。
1,155,"[None, None, None, None]","[None, None, None, None]","[None, None, None, None]","[None, None, None, None]","[None, None, None, None]","[None, None, None, None]","[None, None, None, None]","[None, None, None, None]",['尾巴和腿差不多长'],尾巴和腿差不多长。
1,156,"[None, None, None, None]","[None, None, None, None]","[None, None, None, None]","[None, None, None, None]","[None, None, None, None]","[None, None, None, None]","[None, None, None, None]","[None, None, None, None]",['头和脖子差不多长'],头和脖子差不多长。
1,157,"[None, None, None, None]","[None, None, None, None]","[None, None, None, None]","[None, None, None, None]","[None, None, None, None]","[0.75, None, None, None]","[None, None, None, None]","[0.75, 0.5, 0.5, 0.5]",[],脖子较长。
1,158,"[None, None, None, None]","[None, None, None, None]","[None, None, None, None]","[None, None, None, None]","[None, None, None, None]","[None, None, None, None]","[None, None, None, None]","[None, None, None, None]",['头和尾巴差不多长'],头和尾巴差不多长。
1,159,"[None, None, None, None]","[None, None, None, None]","[0.75, 0.75, 0.75, 0.75]","[None, None, None, None]","[None, None, None, None]","[None, None, None, None]","[None, None, None, None]","[0.75, 0.75, 0.75, 0.75]",[],四个部位都较长。
1,160,"[None, None, None, None]","[None, None, None, None]","[None, None, None, None]","[None, None, None, None]","[None, None, None, None]","[None, None, None, None]","[None, None, None, None]","[None, None, None, None]",['头、尾巴长度相似'],头、尾巴长度相似。
1,161,"[None, None, None, None]","[None, None, None, None]","[None, None, None, None]","[None, None, None, None]","[None, None, None, None]","[0.25, None, 0.25, None]","[None, None, None, None]","[0.25, 0.5, 0.25, 0.5]",[],腿和脖子较短。
1,162,"[None, None, None, None]","[None, None, None, None]","[None, None, None, None]","[None, None, None, None]","[None, None, None, None]","[0.75, None, None, None]","[None, None, None, None]","[0.75, 0.5, 0.5, 0.5]",[],脖子较长。
1,163,"[None, None, None, None]","[None, None, None, None]","[None, None, None, None]","[None, None, None, None]","[None, None, None, None]","[0.75, None, None, None]","[None, None, None, None]","[0.75, 0.5, 0.5, 0.5]",[],脖子较长。
1,164,"[None, None, None, None]","[None, None, None, None]","[None, None, None, None]","[None, None, None, None]","[None, None, None, None]","[None, None, 0.75, 0.75]","[None, None, None, None]","[0.5, 0.5, 0.75, 0.75]",[],尾巴和腿较长。
1,165,"[None, None, None, None]","[None, None, None, None]","[None, None, None, None]","[None, None, None, None]","[None, None, None, None]","[0.75, None, None, 0.75]","[None, None, None, None]","[0.75, 0.5, 0.5, 0.75]",[],脖子和尾巴较长。
1,166,"[None, None, None, None]","[None, None, None, None]","[None, None, None, None]","[None, None, None, None]","[None, None, None, None]","[None, 0.75, None, None]","[None, None, None, None]","[0.5, 0.75, 0.5, 0.5]",[],头较长。
1,167,"[None, None, None, None]","[None, None, None, None]","[None, None, None, None]","[None, None, None, None]","[None, None, None, None]","[0.25, None, 0.75, 0.25]","[None, None, None, None]","[0.25, 0.5, 0.75, 0.25]",[],脖子和尾巴较短，腿长。
1,168,"[None, None, None, None]","[None, None, None, None]","[0.75, 0.75, 0.75, 0.75]","[None, None, None, None]","[None, None, None, None]","[None, None, None, None]","[None, None, None, None]","[0.75, 0.75, 0.75, 0.75]",[],四个部位都较长。
1,169,"[None, None, None, None]","[None, None, None, None]","[None, None, None, None]","[None, None, None, None]","[None, None, None, None]","[None, 0.75, 0.75, None]","[None, None, None, None]","[0.5, 0.75, 0.75, 0.5]",[],头和腿长。
1,170,"[None, None, None, None]","[None, None, None, None]","[None, None, None, None]","[None, None, None, None]","[None, None, None, None]","[None, 0.25, None, None]","[None, None, None, None]","[0.5, 0.25, 0.5, 0.5]",['脖子和尾巴一样长'],脖子和尾巴一样长，头短。
1,171,"[None, None, None, None]","[None, None, None, None]","[None, None, None, None]","[None, None, None, None]","[None, None, None, None]","[None, None, None, None]","[None, None, None, None]","[None, None, None, None]",['尾巴和腿长度近似'],尾巴和腿长度近似。
1,172,"[None, None, None, None]","[None, None, None, None]","[0.25, 0.25, 0.25, 0.25]","[None, None, None, None]","[None, None, None, None]","[None, None, None, None]","[None, None, None, None]","[0.25, 0.25, 0.25, 0.25]",[],四个部位长度都较短。
1,173,"[None, None, None, None]","[None, None, None, None]","[None, None, None, None]","[None, None, None, None]","[None, None, None, None]","[None, None, None, None]","[None, None, None, None]","[None, None, None, None]",['脖子和腿长度近似'],脖子和腿长度近似。
1,174,"[None, None, None, None]","[None, None, None, None]","[None, None, None, None]","[None, None, None, None]","[None, None, None, None]","[0.25, 0.25, None, None]","[None, None, None, None]","[0.25, 0.25, 0.5, 0.5]",[],头和脖子较短。
1,175,"[None, None, None, None]","[None, None, None, None]","[None, None, None, None]","[None, None, None, None]","[None, None, None, None]","[0.25, 0.75, 0.25, 0.25]","[None, None, None, None]","[0.25, 0.75, 0.25, 0.25]",[],腿和尾巴脖子较短，头稍长一点。
1,176,"[None, None, None, None]","[None, None, None, None]","[None, None, None, None]","[None, None, None, None]","[None, None, None, None]","[None, 0.75, 0.75, 0.75]","[None, None, None, None]","[0.5, 0.75, 0.75, 0.75]",[],头、尾巴和腿长。
1,177,"[None, None, None, None]","[None, None, None, None]","[None, None, None, None]","[None, None, None, None]","[None, None, None, None]","[None, 0.75, None, None]","[None, None, None, None]","[0.5, 0.75, 0.5, 0.5]",[],头长。
1,178,"[None, None, None, None]","[None, None, None, None]","[None, None, None, None]","[None, None, None, None]","[None, None, None, None]","[0.75, None, 0.75, 0.75]","[None, None, None, None]","[0.75, 0.5, 0.75, 0.75]",[],脖子、腿、尾巴长。
1,179,"[None, None, None, None]","[None, None, None, None]","[None, None, None, None]","[None, None, None, None]","[None, None, None, None]","[None, 0.75, 0.75, None]","[None, None, None, None]","[0.5, 0.75, 0.75, 0.5]",[],头和腿长。
1,180,"[None, None, None, None]","[None, None, None, None]","[None, None, None, None]","[None, None, None, None]","[None, None, None, None]","[None, None, None, 0.75]","[None, None, None, None]","[0.5, 0.5, 0.5, 0.75]",[],尾巴长。
1,181,"[None, None, None, None]","[None, None, None, None]","[None, None, None, None]","[None, None, None, None]","[None, None, None, None]","[0.75, 0.75, None, None]","[None, None, None, None]","[0.75, 0.75, 0.5, 0.5]",[],头和脖子长。
1,182,"[None, None, None, None]","[None, None, None, None]","[None, None, None, None]","[None, None, None, None]","[None, None, None, None]","[0.75, None, None, None]","[None, None, None, None]","[0.75, 0.5, 0.5, 0.5]",[],脖子长。
1,183,"[None, None, None, None]","[None, None, None, None]","[None, None, None, None]","[None, None, None, None]","[None, None, None, None]","[None, 0.75, 0.75, 0.75]","[None, None, None, None]","[0.5, 0.75, 0.75, 0.75]",[],头、腿、尾巴长。
1,184,"[None, None, None, None]","[None, None, None, None]","[None, None, None, None]","[None, None, None, None]","[None, None, None, None]","[None, 0.75, None, 0.75]","[None, None, None, None]","[0.5, 0.75, 0.5, 0.75]",[],头、尾巴长。
1,185,"[None, None, None, None]","[None, None, None, None]","[None, None, None, None]","[None, None, None, None]","[None, None, None, None]","[0.75, 0.75, None, 0.75]","[None, None, None, None]","[0.75, 0.75, 0.5, 0.75]",[],头、脖子、尾巴长。
1,186,"[None, None, None, None]","[None, None, None, None]","[0.25, 0.25, 0.25, 0.25]","[None, None, None, None]","[None, None, None, None]","[None, None, None, None]","[None, None, None, None]","[0.25, 0.25, 0.25, 0.25]",[],四个部位都短。
1,187,"[None, None, None, None]","[None, None, None, None]","[None, None, None, None]","[None, None, None, None]","[None, None, None, None]","[0.75, 0.75, 0.75, None]","[None, None, None, None]","[0.75, 0.75, 0.75, 0.5]",[],头、脖子、腿长。
1,188,"[None, None, None, None]","[None, None, None, None]","[None, None, None, None]","[None, None, None, None]","[None, None, None, None]","[0.75, 0.75, 0.75, None]","[None, None, None, None]","[0.75, 0.75, 0.75, 0.5]",[],头、脖子、腿长。
1,189,"[None, None, None, None]","[None, None, None, None]","[None, None, None, None]","[None, None, None, None]","[None, None, None, None]","[None, 0.75, None, None]","[None, None, None, None]","[0.5, 0.75, 0.5, 0.5]",[],头、尾长。
1,190,"[None, None, None, None]","[None, None, None, None]","[None, None, None, None]","[None, None, None, None]","[None, None, None, None]","[0.75, 0.75, None, None]","[None, None, None, None]","[0.75, 0.75, 0.5, 0.5]",[],头、脖子长。
1,191,"[None, None, None, None]","[None, None, None, None]","[None, None, None, None]","[None, None, None, None]","[None, None, None, None]","[None, 0.75, 0.75, None]","[None, None, None, None]","[0.5, 0.75, 0.75, 0.5]",[],头、腿长。
1,192,"[None, None, None, None]","[None, None, None, None]","[None, None, None, None]","[None, None, None, None]","[None, None, None, None]","[None, None, None, 0.75]","[None, None, None, None]","[0.5, 0.5, 0.5, 0.75]",[],尾巴长。
1,193,"[None, None, None, None]","[None, None, None, None]","[None, None, None, None]","[None, None, None, None]","[None, None, None, None]","[0.75, 0.75, 0.75, None]","[None, None, None, None]","[0.75, 0.75, 0.75, 0.5]",[],头、脖子、腿长。
1,194,"[None, None, None, None]","[None, None, None, None]","[0.25, 0.25, 0.25, 0.25]","[None, None, None, None]","[None, None, None, None]","[None, None, None, None]","[None, None, None, None]","[0.25, 0.25, 0.25, 0.25]",[],四个部位都短。
1,195,"[None, None, None, None]","[None, None, None, None]","[None, None, None, None]","[None, None, None, None]","[None, None, None, None]","[0.75, None, 0.75, None]","[None, None, None, None]","[0.75, 0.5, 0.75, 0.5]",[],脖子、腿长。
1,196,"[None, None, None, None]","[None, None, None, None]","[None, None, None, None]","[None, None, None, None]","[None, None, None, None]","[None, 0.75, None, None]","[None, None, None, None]","[0.5, 0.75, 0.5, 0.5]",[],头长。
1,197,"[None, None, None, None]","[None, None, None, None]","[None, None, None, None]","[None, None, None, None]","[None, None, None, None]","[0.75, 0.75, None, 0.75]","[None, None, None, None]","[0.75, 0.75, 0.5, 0.75]",[],头、脖子、尾巴长。
